Sentence,Label
亻尔长的外形不准，比例没打好,1
撞上飞快的火车，像摔下飞驰的骏马，车站和铁道线上，是2B照相的好地方。我感觉终于直抒胸臆了~~,0
快组团,0
如释重负啊！下班了都很开心啊。,0
仙女现状：没理了我要告你性骚扰,1
那是我二舅和二叔辣椒我对你失望了都这是大叔啊,0
"1)dontgotogradschool,eveniftheyofferyoumoney.2)dontstartwatchingonepiece.Itwillonlyfrustrateyou.",0
尖了别说，这个头儿挺像的！我看挺象土拨鼠咬你！真萌,0
侬应该懂额又出啥事拉？？？这个确实我们想你也快疯了，群里天天念着你，你不在的日子有人更狂了嗯，想?子想?了。你回来啦,0
亻尔活着就是污染空气,1
比不上男宝包了90%以上的犯罪率，99.9%的强奸犯罪,1
和亻尔接触的时间越?，我就越喜欢犭句，犭句永远是犭句，?有时候不是?。,1
艸早亻尔女马,1
这里发展不好也跟你个外地人没关系，想赚钱就别来广西，其他大城市有的南宁也基本能满足，南宁虽然不算发达，可城建很落后？不好意思南宁城建排在中国十几名，它作为首府也越来越有大城市的样子了,1
#美食推微博人气餐厅TOP10#【河北地区（2014.0220-0226）排行火爆出炉！】本期等餐厅火热来袭。这个周末挑一家试试吧~每周五发布）,0
三里屯village的bhg真心不错，今天买了大批的奶酪孝敬爹妈，补钙从奶酪开始,0
砖家肯定不靠谱！但您老这数学也忒差了吧？亲，这是正规厂家的烟花，如果是土作坊，山寨的用泥土做的呢？所以不要完全信数据，当然了，砖家的话一定不能信的,0
看看这位啊,0
我已经第11了。快！嗯嗯，很man啊，我蛮喜欢黄宗泽，又能发ci又能man看了~许sir超帅,0
#美的厨房电器让红包飞#活动已经结束，请以下获奖者点击进入话题，将自己的中奖信息在2月24日前，填在活动页面上。亲们，期待我们以后的活动吧！希望能给大家发更多福利~,0
我别怪我发飙\r现在BFHF在外面做和平使者\r我看着就犯恶心\r浩饭出来黑人，浩饭再出来做和事老\r别虚伪！,1
我在崔健和杨坤那笑喷了。高手在民间哪。我在崔健处笑喷。民间埋没了多少高手啊亮点在成龙大哥和王杰,0
有朋友说，来了后，总觉得自家厨房变小了,0
想吃就去某宝找切糕王子呗，都上电视了，价格公道童叟无欺，别遇上坏人就当地域犬。——一个河南人???,1
知道自我是飞机场走路就隐蔽点，别昂首挺胸生怕别人不知道似的,1
我们中国不都是大大方方地歧视黑人嘛。,1
向你学习看过许多这样的人，忙忙碌碌周旋于这个那个之间，带着面具、强颜欢笑着。因为面具，别人也以面具待之；因为虚情，别人也还以虚虚假假。看似热热闹闹，但，静静时，却找不到一个可以倾述衷肠的人。最后想想，何必？！该去去，该留留！,0
哈哈，旁边应该再加上我和P老师。你来瞅瞅！怒江真值得来！！这个很酷吧！,0
你娶了我的前女友，我恋了你的前女友。他们的世界真的很小，这么多年，就这么六七个人。谢谢猪！娱乐圈从来不缺料，只是这次的主角让人有些黯然…谢谢猪提醒我。,0
Cool~,0
"正因因此,科学道理;不单而且,我是恁爹冭看你玉树临风，英俊潇洒，风傥，人见人爱，花见花开",1
亻尔这个犭句杂种还真是死皮赖脸我在亻尔亲妈嘴里拉了稀屎看她气喘盱盱的样子就知道她吃的非常痛快,1
期待我们的书早日面世,0
公司只招男宝也没见你叫唤多招女啊，说白了涉及自身利益你才会来叫唤。都是半斤八两,1
我妈说亻尔这个身体跟残废有什么区别[拜拜],1
这海报上的三个字真的很容易被错看成“草泥马”呀！,0
去亻尔女马的“法律范围之内讲人道”你们开心就好哦,1
有压力，才有动力，哈哈！姿势美是首要的，成绩好绝对是必须的！美女打高尔夫，重要的是姿势，球飞哪里，那是球的事说得好！,0
我爱你妈你妈的遗照笑得真美,1
咱掏心掏肺地shuo吧，你能撑起一青楼,1
胶片？真敢！,0
个人感觉，大面积气势磅礴的花海我投票给云南罗平；小桥流水人家型的投票给江西婺源。PS:感谢推荐我的图片。,0
各银行卡的优缺点，保证你会用到！,0
今天晚上喝的客家米酒，真棒！,0
故意的？我们和玛吉啊米是不同的两家改名了？风格还一样不？昆明的玛吉阿米呢不是，是个老宅子，西藏版的“乔家大院”是不是某个电影片段在这？2012改邦达仓了，来拉萨没有去过邦达仓也out了,0
虫子的春天～牛屁了的黑山猪系列,0
你好单纯，看你不顺眼辞退哦,1
懒成这个样子还发什么文章还博士还老师我是亻尔学生口马天天使唤来使唤去的亻尔tm脑子有病,1
认为亻尔是亻囟儿夂辶畐的点赞认为曹金是叛徒的点我,1
完美的结局，神圣的礼堂！有情人终成家属了喜欢莫柔，更喜欢杨帆,0
2014年2月4号，晨，8：00点钟正，立春大马头我们的小公主总算出生了母女平安七斤。,0
长得真有创意，活得真有勇气,1
种马？男宠罢了，还自鸣得意,1
不要激动，好好吃,0
可能观测到大部分黑人智商测验并不如白人，或者是某些物理基础，但是他没办法排除掉“黑人受教育、得到资源比白人少”对这个结论的影响，也就是说这个结论可能是个社会性结果，他作为一个著名生物学家这么说，太具有误导性。我认为这不是学术和政治，这是沃森说话欠考虑了。,1
你也是个看不懂别人说什么就张嘴的喷子。这是在怪联盟吗？看的懂中国字吗？这是在喷美国白皮自己编故事YY自己杀印第安人有理奴役黑人无罪，看懂没？,1
演反派不是健康的形象?！！！我理解的没错吧。。。虽然他很拼命，但是我一直都不喜欢想这个人，看着那些对女星色眯眯的，然后上下其手，就很恶心他,1
理解用户的挣扎//?嗦很多，答案参见如上链接。.....百度目标寻址搜索的比例在所有搜索比例多少，趋势如何？与谷歌，搜搜对比如何，为什么？,0
丑ba怪,1
当时我是拉板胡的，师从上海音乐学院唐春贵老师张老师怪不得鉴赏的音乐全是国际大咖级，不会是是艺术团“萨克斯组”的吧，哈哈推荐大家认识这个小伙子，靠谱的！澳大利亚悉尼内西区华人商会，老爸是我中学的同学，当时我们都是吴淞中学艺术团的。,0
萎缩便抬,1
城外三十里火光冲天烧的就是你妈飘零的骨灰。,1
李老板生快啊,0
00巴黎圣母院11少！！！了你这个敲钟的。,1
帅气的孩子！,0
tfboys_fanclubtfboys组合我一丨丨亻尔女马啊，亻尔特么可以一夕匕了，自己旗下艺人都保护不好亻尔等着吧,1
哈哈哈哈。。。这个猫的眼神霸气侧漏啊。。有木有？,0
什么jb玩意儿古味再见麻烦你们酱铺不要再玩这种套路了不然真yao丸,1
举四爪赞成，最爱面包,0
补偿这个不一定 因为他们美国没这么好心 是因为黑人比亚洲人更早的有移民 所以有更多的时间定居 然后为自己的权益斗争 还有就是黑人敢反抗 亚洲人不敢,1
兄，你有没有遇到过啊？,0
很有兴趣！！！是的。武老师有兴趣？这是丹灶吗？要联系联系好野！前背！村夫，呢个要奖励先得！其实我早就拍摄过了，是丹灶镇西城伏水村啊！哈哈！,0
生活再苦再累，请在心里对自己说：给老子笑。,0
山东吸血鬼差不多得了,1
这个拥抱的前后，差距太大鸟~~好感人,0
我想大黄了，我们给小佳宝养匹小马吧,0
必须点个……赞！！，这餐厅，“话题”传播有搞头…………！！,0
#微爱#我们也开始玩微爱啦！这是专为情侣设计的甜蜜应用，超有爱！情侣专属的聊天工具，逗死人的变音、各种纪念日，还可以记录点点滴滴，俩人的私密空间，有另一半的都来看看吧，超sweet超好玩！,0
实在气不过希望亻尔速速跪下感谢亻尔爹扌品木亻尔这犭句婊子,1
如果思考是生存的证明，我真难判断亻尔是不是一具尸体,1
那得看她是谁?有这样的男人吗？？估计够呛。,0
呵呵，是位学生朋友？欢迎，祝考试顺利～标记上，考完试去看新书到馆、欢迎会员免费领取――《宠物情缘》咨询电话见主帖~,0
喜欢读谢啦。小丫头。Cool~信息量很大...“被庸俗的美国文明同化”,0
看你无理取闹的样子，你不愧是爱男的男孩子一枚,1
哈哈哈，听他说话的男人也很悲剧，哈哈哈笑死了。相当到位啊！总结的很全面必看精品，火速围观啊！,0
重口味的节奏,0
张张都精彩京菜，京菜,0
嘴角上翘，好像在笑！,0
偶与大爱建筑大师扎哈-哈迪德ZAHAHADID滴合影~~不容易啊！！感谢,0
"#吃货游踪#看到美食就饿到不行的童鞋，不如先来个汉堡解解馋吧，地址在这儿：5098TelegraphAve,Oakland,CA94609-2014",0
"这个问题要匿名答。,在知乎，亚裔在美国被歧视，是种族歧视链最底层，才是知乎用户喜欢的答案。你说黑人更被歧视，肯定要挨骂。,在知乎，必须骂ABC都是没骨头的叛国贼，ABC女和中国女留学生都是easy,girl，才是标准答案，不这么回答，",1
sb足协sb裁判黑哨人王tm给你们丫拘了,1
人生没有彩排，每一天都是直播，不仅仅收视率低，而且工资不高。谁下乌鸦一般黑？其实一个更比一个黑,1
扔块肉在手机上，狗都比你会连招。,1
为44什么不理我是7想1让我变成狗不理吗,1
在中国的黑人可以大肆辱骂中国人，还上了新闻！哈哈哈,1
爱屎了！,0
如果是双层的，那就是英国的；如果有这么多层，那一定是印度的了。哪个国家,0
操！在我家门口还不叫我！今晚人比较齐，就少你阿？好像从我这过去不远啊，是惠新西街那？我走着去啊，现在出发！,0
做出这种事的认，该回娘胎重塑了吧,1
真是会给女的洗白，男的被跟踪了一年到你们嘴里被说的这么轻描淡写，女的骚扰男的案件很多，只是很多都没有媒体报道,1
一眼看上去真像。。。,0
……哎呀，可千万别这样，千万别这样，我今天晚上要是高兴死了，以后就去不了了……没问题，放心！凭此微薄，我再送你大份黑胡椒炒花蛤如何，土豆沙拉随你你多少份--都送,0
你这歌人怎么长得这么萎缩,1
如此贴心的节目嘉宾，我和深表感谢，#周末驾到#欢迎有空常来“闹”～提前祝大家情人节快乐～！,0
亻尔的长相突破了人类的想象...,1
要是不按照潜规则，就是伪造国家机关公文罪，5年以下。北京厨子新号:不起诉亻尔女马辶畐,1
现在有的科学家，写论文还真敢yong词儿，nearperfect都来了，你脸咋恁大呢。,1
成龙大哥赶快代言地产吧,0
要不是老师说不让随地扔垃圾，我早就把亻尔扔了,1
Youraisemeup好基友这太给力了！,0
我笑了，当初你不挺傲的吗，此刻您这是又玩哪出呢,1
zhangde真有创意，活得真有勇气,1
诶呀，所有被盗的车都上过锁，所有离婚的夫妇当年都摆过50桌，毛主席也没说过这么经典的语录呀/所有被盗的车都上过锁，所有离婚的夫妇当年都摆过50桌――――你修好片后，请把这句话放上照片，图文并茂的发给你的客户嘛，加量不加价，友情赠送。。。。,0
一会儿就去吃个支持一下,0
"自从我看到beyonce面对她的粉丝以\""我希望我的女儿能够看到一位女性成为我们的总统\""这样蹩脚的理由去给希拉里拉选票的时候，我就觉得这帮所谓为人民发声的白人黑人超级虚伪，她不知道一个女人也可以干出比男人还可恨的事嘛？",1
能认识??是人丨什么东?，都是好样的。,1
热切期待粉粉滴光临哦~今天晚上再去只只经典、款款诱惑，忍不住口水啦，吃货朋友们有木有~,0
Sabi,1
中国联通怎么这么恶心反正就是不停扣亻尔钱把亻尔扣到一夕匕为止中国联通exome？？？辣鸡以后绝对不会用联通并且给所有人洗脑,1
新版cooool2333333233确实，凭这个基本上就能确定三观是否一致了,0
一起来看看我们今天拍卖的这幅画作吧。《粉红伊斯坦布尔》。献上大师与他的作品的合影。超级美！,0
sj发现我什么时候跟你用了绿茶biao的手段了吗？没有吧？绿茶biao的手段能让你迅速听话，效果显著，而在别人眼里你就变成可怜虫，大傻子了。我没用多少。就几次。大黑无形。你肯定没发觉。你还敢觉得你长心眼了。,1
哥们儿，瞧你这iq……是加利敦（家里蹲）大学物理（屋里）系的吧,1
明天当然不是末日，大家都来九江吧！如果明天不是末日，那么你一定要来美丽的九江哦,0
在四川如果不吃辣，周围就像看怪物一样看你，当听说你是北方人，就说哦哦北方就是不吃辣什么的。然而我就是遗传了我那土生土长的四川人老妈而不吃辣，反而我那土生土长的河北人老爸是无辣不欢 都是一群地图炮讨厌的很，动不动就乱加标签,1
用洗衣粉洗衣服，衣服沾上了洗衣粉香味就等于被化学药品腌入味了你长这么大不会一次澡都没洗过吧，我的天，那得臭成什么样啊,1
刚听完许巍此时此刻新碟试听会。我说新专辑很棒！编曲异常出色！他浑然天成的共鸣腔和刚好的沧桑，宛若浮世里的世外桃源，空谷里的蓝莲花！听许巍能让心沉淀！空谷幽兰喜悦爱情此时此刻逍遥行世外桃源可以每一首都推荐吗我在:,0
这个东西真的sha逼。。,1
黑人那是赤道晒得吧，大热天做题谁做的下去，美国黑人，在同教育下，智商不低的，如果没歧视经济等因素影响的话，高智商里谁多不一定呢。 黄种人繁衍。。。明明jj最小啊，精液也少啊。,1
不是，中国人对种族歧视的标准是：只有我可以歧视别人，别人不可以歧视我。中国人反对的不是“种族歧视”，而是反对“歧视中国人”。中国人简直爱死种族歧视了，什么倪哥棒子阿三越南猴子，那都是妥妥的劣等民族，,1
反正死的都是我们河南人，活该啊。死的越多偷你们井盖儿的越少。你们这些外省人不该谢天谢地？,1
不抽这一口下一秒他全家都会螺旋升天,1
你怎么抢我台词微博只有抽奖的互联网乞丐男宝一枚吖,1
知道你妈也愿意跟他睡了，你以后也找这么个脏黄瓜呗？,1
准点下班，明天各位有好吃的了！,0
想吃红烧肉的童鞋注意啦。。想吃传奇红烧肉的童鞋们注意啦。。你们在哪里？,0
多谢?这金刚盘的漂亮?没有干盘的新年好！品相真好，干净，漂亮，?上油的吧！,0
美时美刻，四季养生。北塘古镇客户俱乐部系列活动之“乐享瑜珈大美人生”。,0
要移民火星，是为了要离开亻尔,1
不要走~~~~，我很喜欢你的微博的！天天刷我会上瘾吗?晨初老师，别这样啊，但愿你是在开玩笑。天天刷的就是你啊。,0
卖皮炎还卖出优越感了,1
就是啊，那他（她）得多可悲捡到刷爆,0
但是感觉有点恶心啊，这都能下嘴，这个男生好惨,1
重点在于心态。,0
问题=机会1）公司的问题，就是晋升的机会；2）客户的问题，就是销售、精进的机会；3）自己的问题，就是自己裂变的机会；4）同事的问题，就是建立人脉的机会；5）老板的问题，就是赢得信任的机会；6）竞争对手的问题，就是变强的机会！,0
洗面奶护肤水身体乳这些男生都可以用的啊但事实上有几个男生会注意自己的形象要知道男生可是干净一点就能成为帅哥的….有能耐你们也腌入味儿啊别把不爱干净当成骄傲,1
你就让他们相信中国不好呗，你管他呢是他爹吗还给他义务教育…他们相信中国不好是因为他们希望中国就是差的，那就让他做瞎子去吧,1
2014必须红火！,0
你们两个专业打酱油么？怎么谁的酱油都打呀？去看看？Dara要来北京拉将于4月19日在北京万事达举办“AllOrNothing”演唱会，新晋男团Winner有望任嘉宾。妹纸们在中国的首次正式亮相，支持起哇~,0
周末加班的我。邪恶了……,0
跟炖监狱没区别，有吃有喝，里面打不开外面能打开，,1
估计这个女的卖的东西也是用这种方法骗来的吧。这就属于诈骗啊，你当初为什么不报警啊，就算报警没有用，也得搅和搅和她。,1
三天能看出个鸡毛啊同事都没认全几个,1
艾呀，梅事的,1
小清新的火龙果盆栽~！好美啊！,0
wowGETTYcorbisIC完全都没拍到,0
原来男的真的不关心男性吗，怎么男性比女性多那么多人发声时人就不见了,1
那个男生恶心透了,1
强！,0
大学叫兽,1
"你说的这种，把男人当工具人的，归于田园女拳，其实田园女严格说来不属于真正意义上的女拳，她们躲在女拳背后捞点好处而已，属于危害最底层次的女拳，这类的，自己不要当舔狗就行了！,比田园女层次高点的，竖立男女对立，",1
北方人他妈的都是亻囟儿夂辶畐,1
搞清楚，原答案只说生活琐事，没提男方出轨，如果出轨我劝人干嘛！踩了你痛脚?出来乱咬人！,1
祝永远幸福！！！,0
把您的名字最后一个字加神，会出现____。如天神！,0
好！,0
隔壁那幢楼的邻居真是勤劳又能干啊，才11：20就开始炒菜，说准备吃饭了。我一个小时以前才起床呢。,0
终于看到浴袍照回家丢脸去了偶们又来了重庆的六个神经病已经享誉天津了，这是要红向全国的节奏啊！温泉很美好，谢谢#百名达人游津城#,0
若是你拿苹果5的话，我拿果4跟你换/我报了“人文”类，拉票时间等到mini搞到手，见面一人玩一次,0
【#超级笑星#微直播】5号选手徐菁瑶用树叶来问好，小姑娘年龄小，身段好，嗓子好，又聪明，多才多艺，连王晶导演都说了“徐菁瑶很可爱，很漂亮，她要签的话，我马上签”让小编好羡慕啊~,0
有可能他们网上只是性别是男女，有的男宝不过是被我戳穿了，在一般里。,1
真的讨厌东北没素质的人,1
今早太欢乐了，我觉得这招比离婚好留存备用离婚神马的弱爆了。这都行？！,0
csdxzz,1
小样吧！！,0
尼回头吓到一排教学楼，你回头山崩地裂水倒流，你回头哈雷彗星撞地你回头姚明改打乒乓球,1
白叔叔您是我们年轻厨师的楷模快二岁了白舅舅，我妈说您的外孙子真可耐，她问小外孙多大了？传承随园菜咱是责任真不错，拍的很有意境，白爷任重道远,0
我操亻尔女马辶畐气死我了,1
"444要点。,,b脸",1
可耐的小裤裤,0
“上海女生都娇气败家，任性抠门，作，不懂体谅人”,1
想出去的同学们参考下。少年不努力，一生在内地啊。转给同学奖学金港币2万一个月，一年24万。还有其他的免学费住宿费啥的，加起来据说三年81万。总的来说，钱多事少离家近。还有哈，老师特别赞！,0
网易的策划都是丁磊养的猪,1
好好考试哦~~考完了来黄土谣吃羊肉泡馍~~,0
天涯老帖，挺韩公知太形象了,0
exin,1
支持告，告他么的，谁撤诉谁是答辩,1
这鸡翅，真特么辣！真特么香！当餐馆老板，不就这点好嘛――想吃啥随时有人伺候着~,0
必须要啊，地址发我手机，回家打包行李悲了个催的~我正感冒呢~~要不要和我去住丽丝卡尔顿啊~~欧了个克啊，带你去喝酒~,0
我反对种族歧视，但我讨厌黑人,1
真论抢劫，干坏事黑人比得了白人？人家白皮才是真正的行家,1
欢迎,0
#高级定制#VCA定制系列超美16花...这是我最喜欢的一款长项链，大大小小的花朵超级有型，时儿高贵复古范儿，时儿潮暴装备必需品...大爱啊大爱啊...各种材质都可以预订哦！基本款式有／黑玛瑙+灰贝母+白贝母／青金石／孔雀石...喜欢的童鞋们赶快吧???...,0
他们说我今天是粉红女！哈哈，一身粉嫩！,0
潮忻土忻傻傻分不清楚,0
请问文火炖的是什麽肉呀？这张有那么点强调了,0
你读书少，看不懂套路不怪你,1
看你奏各路都昂首挺胸的，怕别人不知道你是飞机场吗,1
最后还是忍住没吐，恭喜！,0
造谣户口本是剩一人嗷,1
铁csdx,1
发行很到位，辛苦啦大家来瞅瞅,0
????,0
乔口越来越热闹哦,0
你真是的，人家同意你揣回家了吗,0
亻尔光着身子追我两公里我回一次头都算我是流氓!,1
立flag，j222jk的c555位多我就再买一张，不多就qnmlgb吧，滚你的区别对待吧，质量不要求和别??人一样，至少数量上对齐吧。,1
几tian不cao你，文爱技术jian长啊,1
寻找同人！该房间现有新派公民寻求合租：单身女性，非常喜欢新派，现寻觅共同合租开间的女性！有意者请私信或拨打电话与新派联系：65258366、65131799！,0
作为一个山西人，表示你不用理会他，大部分山西人思想落后且蛮横，不需要对他们友好。,1
人妖给摸我也要去的你个花痴哦说不定明年就换人妖了估计明年更加多，明年我要去看的公司没下限了,0
瀑布瀑布呢,0
嗯呢你不讲卫生你有理,1
有。,0
真百搭史上最万能的广告片，亮点很多，要hold住！作者太有才了,0
当代小仙女现状,1
难道全世界都歧视黑人？肯定没有 那就不存在任何歧视黑人了吧？按照你这个理论 全世界什么矛盾都没有了吧？白莲圣母同学. 说话都不带脑子,1
"真正的无知装逼吊丝泼妇,不是来自菜市场的师奶,而是那些有病发烧三天、无病呻吟说“懒得理你”却滔滔不绝并大喊“大家来评评理”的人欢迎评理",0
一丨丨一夕匕亻尔,1
面壁去了。面壁去了,0
谢谢，知音啊男人胖点挺好现在199斤你能瘦到200以下再说＂瘦了＂我都瘦了你就吃吧,0
#李公堤御庭#活力苏州，传统苏州，水乡苏州，一边是传统园林的优美与静雅，一边是摩登城市的繁华和光影，不同的视觉，不同的苏州感受?而李公堤上的御庭有异曲同工之效喔，欢迎亲们来苏州喔喔,0
你就是新时代的武?,0
是三亚的悦榕庄吗？全换新衣服了男人也爱~~~,0
嘉里健身和嘉味也在现场哦，欢迎各位童鞋去一试身手谢谢志愿者和工作人员的辛勤准备工作，今天将在京西学校为大家奉献一场美味橄榄球大餐！#NFL主题公园北京站#,0
活动详情http://深夜，最温暖你心的食物――每个忙碌的都市人都希望有这样地方，在最平凡食物里，品尝到最不平凡的百味人生！我们准备好佳片美食，等你来分享美食故事～现场观众还可抽奖浦睿提供《深夜食堂》5~8集新书、笔记本、精美书签…,0
每次看到这头驴，我都会感觉自己的工作压力也不是很大。,0
造谣已定10.1出版，国庆献双礼。是，几次设计不满意，所以慢了，快出来了俞总，全国图书订货会书目上说毛尖的两本影评集出版时间是1月，现在都快五一了怎么还没上市？,0
哈哈我们的晚娘系宾个也有“晚娘”这个词的哦！羊晚的呢？,0
亲，祝您的父亲生日快乐，父母是伟大的～都太的这个店可以看海景，好好享受一顿美餐吧,0
发！烫着大金字的！等有娃了。我们接着吃要不要给我发个奖状呀。最铁煎饼果粉奖全景记录，那天我们自己看，都惊讶，我们原来还有这样的日子,0
1239年建立的因斯布鲁克是奥地利蒂罗尔州的首府，坐落阿尔卑斯山谷之中，意为“茵河”上的桥。小城保持着中世纪城市的容貌，狭窄小街上哥特风格的楼房鳞次栉比，展现出古城的风貌。著名的滑雪胜地，1964年和1976年两次举办冬季奥林匹克运动会。小丸表示夏天在茵河边远眺雪山吃冰淇淋超惬意的！,0
一大早马尔代夫就上排行榜，要好好利用，多给大家介绍马尔代夫这练手的地方八错，我恐机。一定要和他去马尔代夫，最向往的地方!,0
谢谢！祝用餐愉快！,0
要注意了！,0
拿你当?的777时候*，你尽量装得像点好吗,1
你这张脸可成了全球翅鸣品牌商标了。,1
谢领导支持,0
主要太吃藕，像个变态,1
二枚帅哥，二枚美女，鉴定完毕昕薇不只属于九零后零零后！,0
赐雨亭上布衣男（赐雨~~痴语）前来围观,0
???一起努力！接下来会更好！??,0
抽着玩儿,0
亻尔是不是看到咱们这样身心健康没有性病的市民就打心眼里愤恨呢,1
你护膝就是污染空气,1
留着当胎教超能锻炼思维的优秀电影，存了慢慢看。,0
我就yu闷，这年头的nc神经病怎么就这么多。。。总是阴魂不散的有本shi你冲我来啊，你别骚扰人啊,1
