Sentence,Label
恨国党们一方面拿黑人中的精英论证黑人的优越性，一方面又拿中国人中素质低的群体论证中国人的劣根性，如此双标实在好笑,1
滚回家把尼女马叫出来给大家草草,1
通讯录短信内容一样可以做丰富，现在商家其实非常依赖短信广告，收编营销文字的展示效果和用户喜好和评价，可以帮助短信商家客户收集反馈率，提升营销准确率。还有，客户端是可以模拟短信的，如果你想清楚了怎么用的话。这是我去年12月的规划，现在无用了。送你参考,0
(⊙o⊙)…,0
去他妈的亻囟儿夂辶畐新娘。我也不明白她们瞎折腾啥。要我直接就跟新娘说这个弄不了。,1
这，tmd也太美了。。。潜水去水底看照片，应该是编导的主意吧？,0
越南美食也是洛杉矶特色啦市长同志推荐了。那要去看看吖~,0
掌握好方法很简单滴，一根筷子足已哇！剥一只得多长时间啊？这个太难了！,0
跟你能好好说话，但不能说好话,1
哈哈不好意思确实不太礼貌，无形中黑了一波东北人吃蒜，但其实我并没有觉得香港人高人一等，我只是觉得很多香港人自以为比别人高贵而已～,1
真没想到，3年前劈头盖脸的一顿骂，换来了3年后的这张卡片，好珍贵的礼物啊。曾劝慰过很多失恋，或感情不顺的女孩儿，得知你们现在都很幸福，老太太我也安心啦。一切都会过去的，好好爱自己吧，后来的姑娘们。,0
欢迎来露营公园下个假期也要这样过,0
ren为你是傻bi的点赞认为曹金是叛徒的点我,1
百度什么时候似,1
如此变态的整ren招数，相xin只有某岛国才敢想得出来。。。,1
火影再怎么黑人家，但人家完结了，而且火影虽然喜欢回忆，但是只要不回忆的话剧情还是很饱满的，不喜欢回忆不看便是。海贼是拖，一个画面能给你拖三十秒，让你看了恶心不看还不知道发展到哪了。,1
我想看着你说话，可你为什么把脸埋在你的屁股里？哦？对不起，我不知是你的脸，那你的屁股哪er去了,1
在杭州感受新能源出租车，中途换电池低炭出行，杭州给力，就是续航能力稍微弱了点,0
这些人都是亻囟儿夂辶畐口马？就问一句:屁大的时间亻尔嘴里不吃点垃圾食品亻尔会一夕匕啊？黎明出门还要带着瓜子，爪子，苹果，葡萄——令人哭笑不得的族群~就算吃，不扔垃圾不可以口马？不要的垃圾全装在袋子里放进路边垃圾桶不就行了，能带来不能带去？,1
二姐，我必须得支持你～我05年第一次进藏的日记也一直没整理呢。在这方面，咱俩真是慢的一致啊～,0
哈哈哈哈放弃吧难得看见个理智点的你跟非黑即白的二极管沟通有啥用？,1
所以再向前走两步，会看到整形医院的广告牌,0
开心的要命！,0
这个研究太可人了,0
看新浪怎么判呃我记得老榕叫王峻涛啊，我画得明明是贾玉榕，怎么会是你？难道真相了？老榕你亲爹姓贾吗？老榕竟然举报说这图画得是他！你也太自作多情了吧！这还有主动对号入座的，我要画条狗你也来对号入座,0
矮油，不?唷,0
打篮球真low,1
你俩有机88会记得一起睡个觉靴靴,1
事实是一大批女宝抢着干..就问你离谱不？,1
没问题弄来两辆试试吧！我们组有个嫩黄的骚内A7,0
油饼,1
新西兰天气不错哦,0
难道你爸妈没教你为人处世的基本方法吗？,1
实话大实话啊对亻尔这种人，只能说，亻尔可以去一夕匕了。一天到晚瞎昊给亻尔爸一丨丨人设，亻尔可知道亻尔爹的所谓蜜汁人脉都有事亻尔姐姐的，所以亻尔爹紧抱姐姐大腿。歌唱不好，戏演不好也就只能靠亻尔这种智障一丨丨人设吸点脑残粉了，说是废物也不为过。,1
你应该多吃点三鹿奶粉,1
尼没得麻雀,1
再jian了，我对不起你，我会把你的遗体好好弄hao的，对不qi。,1
谁说猪的脑子最蠢？握说猪的脑子最聪明，吃包了就睡，什么也不用养得肥肥胖胖的，只能说猪的脑子保养的好，你得脑子也是保养的最好的。—人不带脏字的,1
好消息,0
你真的是个csdx,1
太震撼了，我去巴黎的时候怎么没找到这样的好位置，哈哈！,0
你生活中？....哦，看到你的地址我就懂了，果然落后地区的人都不开化,1
爸爸麻麻们认可么？,0
有福共享，是为有福！社长久福，尚久享老周大智，且大勇！！关键时刻，好人露出英雄本色！保卫酒窖！保卫公社！保卫欧美亚非拉！抄家!,0
4s店的售后服务果然是，女马的，赶快去一夕匕，我一丨丨,1
还有cc下面的相关推荐全是jj，亻尔女马是不是一夕匕了啊，利用我宝宝,1
百度真的是个彻头彻尾的辣鸡，你们体工给用户的搜索结果是什么鬼？百度,1
热烈欢迎~~吃得开心哈。。。,0
鱼儿自在水中余通鱼，遇水成诗。江上往来人，但爱岩茶美。君看一叶舟，出没云河里。江山往来人，但爱岩茶美……/,0
哈哈。这代表你们编辑部效率高，人才多，低投入，高产出。好事啊。哈哈，这是谁干的好事啊？,0
你的词汇量也是让我不想与你纠缠毕竟你100个爹并没有给！！你快乐的童年,1
任何人工智能都敌但是阁下这款天然杀剐,1
哈韩的妹子们要激动了,0
按这道理欧美歧视华人也是理所当然吗？,1
哈哈，我也看到啦，这两个车主要么死敌，要么就是互相拆台的损友,0
真的难怪香港人，台湾人，abc们歧视这些人的，一锅老鼠屎坏了一锅粥，我想象得出那个场景，自以为圆滑世故很厉害的嘴脸，实际在正常人眼中屁也不是，恶心,1
错了，是在右上图D基础上，右下是成图了。,0
有男人的地方就有危险不管是他们身体带来的还是脑子不好使带来的，反正这种生物真不适合大量存在,1
以为柯南的技能都是天生的？！惊天大发现，夏威夷是个神奇的地方！除了有蓝天、碧海、沙滩、美女，能度假、购物…更能培养拔尖人才！柯南，你瞒得我们好辛苦~戳大图看真相夏威夷柯南培训中心，全方位培养，淡季出行，限量抢购7999元起~教练，我也要去夏威夷！>>,0
终于熬过了最辛苦的几天！大家辛苦了！因为大家的坚持！我们共同渡过了难关！加油！,0
我爱你妈你妈的遗照笑得真美,1
我不厚道的笑了噗！我真喝茶呢，别搞笑。过年去华盛顿参加反美研讨会？,0
自己有奶的不要跟母们抢！你的我也先预定我也要~~~~哈哈哈哈够富裕哒！！！一个样儿的来一块~,0
嗯呐!速度真快！哈哈！！！,0
中大是相当的好！而且最近在很多细节又更加感触：看了各个高校的学士服，还是中大的最好看（请参照RMDX/JTDX等众多院校。）。中大中大，不在其大，而在其中。校区多选,0
您是不是把敌敌畏当可乐，把您那八毛钱十二斤的脑袋喝秀逗了,1
真28°啊？还是谈天气吧！安全,0
~给力！,0
然后。。。我真不知道谁给谁买单去了然后呢？,0
时间快呀！各位又快到用午膳时辰了，准备开餐传膳啦,0
同贺新年快乐！???祝各位一?当先，?到成功！！,0
打团的时候跑这么快赶着去参加你妈葬礼？,1
你zhang的真tm后xian代,1
这个阵容！估计此珍藏版离彻底删除不远了！这种组合已成绝版经典。,0
我多买了几辆，这样就不怕北京每天的车号限行了,0
你?张?拍jiu是全家福,1
还有隐情吧?掷地有声,0
期待下一次的精彩！,0
#内观禅修#课程圆满结束，我被放粗来了哈，大家都好开心保持觉知。保持平等心。生活中继续修行。。。快来，今天的天空好美啊,0
减肥的人要忍住最近海鲜过敏能吃伐？【台商庙会又来啦~~！！】5月10日－13日在上海展览中心(延安中路1000号)举办，不知道这次会不会比上次的好点？吃货走起啊~~,0
大概就是猪还是主，狗还是狗，知不过是种族不同,1
"好久没动笔画画,打算恢复一下……＃小吉手绘#No.01白描耶路撒冷希望大家还喜欢",0
众亲春暖花开你可以带TA满足下美胃了哈青年餐厅超值团购来袭！已售万余份价值100元现金券―仅售78元！这个真的可以有！！,0
虽然你身上喷了古龙水，但我还是能隐约闻到一股人渣味儿,1
与上海屈臣氏那只黑鬼相比，这只简直就是温顺的小绵羊！,1
犭句一直是犭句人不一定是人骂得真好,1
推荐大家都看看！更多精彩稍后将继续为大家献上，欢迎继续关注！,0
今天你“摇”了吗？,0
这tmd是人干的事***儿吗？,1
哈哈哈哈哈太喜人了这个干脆面你丫就是个魂淡！,0
笑醒了爸爸们，节日快乐！最后大喷！！！,0
那就去解救啊，把那些爹妈和那个磁暴步兵抓起来啊，都他妈快成邪教了！[思考][思考][思考],1
不管是不是南师的，这种情况在中国非常普遍，武汉高校，黑人留学生搞一百多个中国女大学生非常普遍，还有大肆传播艾滋病的一大堆。,1
什么牛马公司，就这格局注定不会有什么发展,1
你来可以当时给你做哈要等到下个月呀,0
公交车，可以去鸭店搬砖了,1
一样…… 我现在看到某些不了解台湾时政，某些跪舔的大陆同胞，张口闭口，血浓于水，或者强装“理中客”的也恶心想吐……,1
大gai天生有人爱chi屎,1
滚尼66玛逼,1
酒店版夺宝奇兵赶紧来参加啦???LanghamCool在哪里呢！赶快找一找啊~,0
小美，很高兴见到你！,0
真是醉了，这么多喜欢找挨骂的，智zhang还有问题的，坐火箭出国的。,1
祝老爸父亲节快乐！！平时错气来西，通个电话倒觉得老爸异常可爱，哎，还是有爱的我。朋友说我老爸像那美人阿凡达来,0
我记得你还有21~9、17、19和我好像啊3和720！！！,0
菜b没资格喷人，越喷越杀，跟男女没关系,1
你天天被潜规则吗,1
玉米煮2小时，加入菌菇，丸子，15分钟就完成啦画面好温暖，果断求食谱！,0
没错，太可恶了，这种楠的让小仙女跟踪下怎么了,1
你妈被lun奸了,1
盛产骗子的是诈骗岛台湾，谢谢,1
哈哈哈班主任！！我们来拉！,0
奴cai一群,1
【#超级笑星#精彩剧照】《超级笑星》第五期还有不到两个小时就要开~始~啦~！小伙伴们都准备好了没~记得今晚一定要锁定，忘记一天的劳累，和家人一起分享《超级笑星》，笑到嗨不停哦~,0
【城市之音四川台FM102.6】城市之音#2013校园迎新#-明星音乐教室。在电子科技大学与热情的歌迷大合影送上！,0
看你这么急，电刑副作用确实大，慢一点是不是觉得很害怕？怕被电还不敢反抗是吧,1
都是降智怪,1
见到这个女人太jian了，人家说两jin半，她非要三斤还说钱多北京·密云县,1
是啊女生只是吵架男人可都是打架真性情呢,1
你们的人性在哪里？你们的人道主义在哪里？fuck,1
我说我的眼里一直有你,0
"鸡就是鸡,,,，五颜8六?还是鸡。",1
是的。 你还好意思说你是女的，爱好男男，呵呵，你不知道艾滋病就是同性恋传染开的吗？,1
出轨好像确实不算犯罪，这事儿把其实，男人们别急，出轨要是不算犯罪，婚姻法不能给予惩罚，女人们就该跳脚了。,1
sbzf,1
你还是不明白什么叫种族歧视。就算是你是农村的，被人歧视，但是只要你是城里人，就不会被歧视。华人则不然，无论他们身处哪个阶层、哪个地区，,1
我在这里:,0
继续努力拍更好。,0
【童年版小龙女曝光跪求12岁小Loli别长大】于正版《神雕侠侣》童年版小龙女曝光了！小小龙女一双水灵双眼皮大眼超级“卡哇伊”，萌翻众人。一票网友专注黑“大龙女”陈妍希30年，激动调侃“求小小龙女不要长大！”,0
#昆明市滇菜烹调师、滇式面点师技能大赛#现场，菜品精美吗？,0
黑人被警察打死的案子无一例外地去了法庭，法庭该怎么判就怎么判。关警察什么事。再说了，警察为什么看到黑人就紧张害怕，还不是黑人大概率动辄动刀动枪，黑人只会叫黑命贵而不反思自己，,1
你属黄瓜的，欠拍。你媳妇属螺丝的，欠宁,1
你别西游记啦，改看这个吧!很写实嘛这琵琶精长得一目了然不然肿么表现琵琶精呢？商纣王还真是重口味，能把天下亡在这样的仨货上一点儿也不冤了！,0
笑死个人了莫言：一年小说白写了。。。。。,0
您今天吻了吗?亲一下!,0
最美杨凌农博园~每年春节都有好礼，真贴心呐每年春节都有好礼，真贴心呐,0
你言论有误，看不起黑人的观点应该受到尊重。毕竟知乎是中国的知乎，在中国的论坛里面看不起外国人难道不是正常合法合理的。需要你来判断？你够资格么？,1
圣母是阻碍社会进步毁灭文明的内因，以无限牺牲他人利益为自己的低级快感添砖加瓦，是匕匕以神的名义无恶不作的精神病患者更龌蹉的存在[微笑]。,1
"尼玛的扫货,锤子长在脑壳上,我都奇怪世博会怎么没喊你去展览!",1
一不小心成了乐途旅游网首页FUN行者，本期推荐目的地――新西兰，纯净又神秘的东土世界！,0
感谢博客君推荐！泡总作品！,0
我歧视黑人，我就是看不惯黑人在中国有种老外的优越感,1
辣妈#可儿#的白色清新搭配，你也喜欢白色不妨参考一下吧~衬衫：DianeVonFurstenberg；短裙：Lover；鞋：AlexanderMcQueen；眼镜：ChristianDior【私享穿衣顾问微信：FashionTalent33】,0
仙境，画壁应该到大溪地拍#品行答疑#塔西提岛（Tahiti），一般又称为大溪地，是南太平洋中部法属玻里尼西亚社会群岛中向风群岛的最大岛屿。已超级清澈的海水、未被人为破坏的风景而著称,0
瞅你自我长de跟被千军万马踩过似的，蒙kuai抹布也没用,1
邦达仓大院啊！又能参观又能坐在院子里发呆,0
前些天就听说阿芙2014年有大动作，想不到是与我超爱的蓝胖子合作之前与陈漫合作的包装设计美到爆，现在超期待阿芙携手哆啦a梦的产品。拥有哆啦a梦一直是我的童年梦想，阿芙，阿芙，加速，加速,0
天下之大，大但是你缺的那块心眼,1
谢谢大家了别忘了喝我们送你的酒哈,0
思想有多远，你就滚多远；光速有多快，你就滚多快,1
你没父母所以生活能自理,1
我儿纸长得像我吧~鼻息肉是遗传么，为啥我有他也有？,0
明知营销号的东西都是造谣生事，还跟只犭句一样跟着口丩，也是满足了他们的黑暗心理吧，还是有市场的。,1
赚碎滴钱,0
"没有最假,只有更假!!!",0
带路的不会是牛头马面吧???该啊！哈哈哈。。。。。。带路的是雷锋,0
这也是答主为何报复的原因所在，自己的女朋友都管不好，玩个游戏到处骂人，被举报惩罚了就来这里黑人家，你这样的人总有一天被甩的。,1
有点sha逼啊，他不应该杀全世界的人么,1
跪舌忝唯饭的都去死去一夕匕,1
是啊，在我们这边，日本人三个字就已经是骂人的脏话了，,1
东北人表示在饭店叫人直接就大喊：服务员儿！都这样，民风剽悍??(??????)??,1
"一群sb往南飞，一会排成s,一会排成b",1
加州，中国第32个省！,0
将要奔3的人儿，今儿生日快乐哈！！不愧是一家子，这么巧的事都能发生！哈哈生日快乐,0
评论区真是吓人，那么多人给男的洗白吗？迫不及待地把自己代入了视频中男性的角色，然后就是 暴力有理 ，妻子烦了你就要打回去。真是叹为观止。,1
不想起床，有请早餐的吗？最近发情了，食欲有点大，西塘找不到好老公，不知道杭州是否有艳遇可爱的加菲猫?喵我在这里:,0
在河南的熊猫都是河南人用井盖换的。,1
洛杉矶黑人暴动警告，加州并不安全；黑人并不尊重华裔。民主党白左精英仍然认为华裔是半人，,1
中枪了,0
生存岛上的捏泥儿，厉害吧厉害吧,0
给咱校争光还得加油啊。。实至名归！我觉得应该更加努力进入前三！希望每一位已经毕业的同学们都要加油，hold住整个主持界，让师弟师妹们也可以骄傲起来！,0
二逼主人欢乐多。。。,0
雨后，北京,0
城市1对1对咱家的报道三,0
普及了USB！太棒了期待推广,0
记得好就对了！,0
他们怎样能管你叫猪呢？这太不像话了！总不能人家长的像什么就叫人家吧！怎样能说你长得像猪呢？那是侮辱了,1
那张一天到晚贫个没完没了的嘴哈哈太对了！！,0
亲…给点想象力好么？#与其相濡以沫…不如相望于江湖#第五个菜名叫尸首异处？？我比较关心老板疯了没？,0
可能就坏在惠字，为什么是实惠的惠呢。,1
你不服你去统计啊说“十男九嫖”“(我出轨、生私生子）只是犯了全天下男人都会犯的错”——这些话可不是女的说的,1
我们知道有八千万不是一般的保守。房产建筑矿产洗浴夜总会太多了我都咖啡色了保守估计，我国涉黑人员将近8000万人,0
要不是我当年和你妈有个美。。丽的误会此刻---也不会有你,1
大美妞，改天约个饭呗,0
这告诉男人们不能出轨出轨家破人亡,1
每天早上看着爷爷把yo宝接走，我回屋再睡个回笼觉，感觉爆好！每天早上看到奶奶喂赖床的儿子吃早饭，感觉暴差,0
在母亲节送给妈妈一份甜蜜的祝福吧,0
可算能评论了。。。哈哈。。。大家给我评论啊。。。,0
河南人偷井盖 说烂的东西了,1
人生处处是尴尬！不要这样好吗！！！（转）,0
新书自序。请扩散。,0
肌肤之亲,0
民众的医学常识几乎为零啊，呵呵哒亻囟儿夂辶畐太多，亻尔有什么办法？,1
说的对，男人们要团结起来远离女人,1
开眼开眼！你们多找点老的广告吧，放在多好玩儿,0
中枪的有几个？,0
看看我在干嘛？自己摸成大花脸了，睫毛都被烧了。,0
这男的不就是一公交车，你理解能力有什么问题？,1
可能就是那一秒爱上一个人欺负二叔的日子心情就是好坐在车里看着二叔抱着我一打的快递在小雨中踱步走来，我就好想笑,0
今天是三十。收到大家的祝福了，就不一一回复啦。现在说一声新年快乐，心想事成哈。附上早晨二伯大棚里刚摘的新鲜草莓，你觉得咋样哈？我在:,0
评论区看的我大为震惊，希望觉得巧克力有虫是正常事的潞人吃到的巧克力都也虫,1
10月23日，北京市文物局2013年信息、微博工作人员培训暨2012年工作总结会在大觉寺举行。和获评2012年度微博先进单位。主页君也被评为先进个人啦～哈哈哈谢谢大家，谢谢CCT……咳，感谢大家关注～谢谢大家对我馆工作的支持！,0
我鸡大。能插不？,1
好诗，寓意深刻。不懂诗，但是非常喜欢这首。。能让大家有兴趣多读点诗，我也很高兴。谢谢洪晃转发，刘原夸奖。多年不读诗了，浩波兄的这组诗还真是读得特别有感觉。这是我近年来读过的最好的诗，没有之一。最好的,0
月未凋花未缺一切都很好:s3b垃圾玩意，握着版权尽出一堆垃圾玩意，霍华德你前传版权拿到了把，拿到了赶紧出1/6出你妈比的cos侏儒垃圾！,1
体验瑜珈我在:,0
徒步漓江的午饭！！干杯！遥祝你生日快乐啦！！！,0
这bjue不是人操的,1
你出生时是不是被扔上去过３次而只被接住过２次,1
北京市侩，做人傲慢，骂人难听,1
见证历史的一刻嘿嘿第一次做粉蒸排骨哈哈揭开小碗没拍出里面的荷兰豆,0
请问这两位同学，你觉得哪个比较强？,0
谢谢帮忙转发##补充##：性别不限，有三年以上女性类、时尚类网站或广告公司相关工作经历者优先，如具广告策划能力更佳。就职公司为传媒集团背景，待遇福利佳。同时【招聘资深市场推广】一名。/好工作，帮转！眼尖啊！好工作，帮转。,0
回去洗洗脸，jiesong你斤香水，盖盖你身上的大渣子味,1
新年快乐，心想事成！,0
今天和一起吃饭，很是happy，最近一直很是忙碌，好久没有这么酣畅淋漓了，得友如此，人生无憾！！暴雨依然抵挡不了我们的热情啊,0
"利比亚的奇葩历程了解一下？,冥煮社会熏陶出来的黑人回国后压迫本地土著",1
达?芬奇《蒙娜丽莎》的微笑，永远神秘。俄罗斯一些专家认为，普京总统的微笑最接近蒙娜丽莎的微笑。,0
安逸噢?瓜p一个二个的带啥子哟恁恩莽撮撮的哦砍脑壳的背时娃儿末求天盎撮盎错的找不求到带弄些啥子玩意,1
#Travelzoo旅游族超值酒店特惠情报#将酒店与当地特色必玩景区联合起来的一站式套餐，你感兴趣吗？推出【旺季优惠套餐】如￥520起；￥518起；//,0
很白很天真很黄很暴力！,0
#中国哪里最好玩#来宁夏，“迎宾楼雪糕”是不容错过滴,0
穿红着绿，观夏初清朗风景，身侧有友如花，不胜乐之！,0
算的…你想想假如题主说了东北航线啤酒每次都被一抢而光 不是侧面说明了东北人没素质么…占便宜？,1
我的没有了转我也留着来！！就一本！！在兰州！这可是我最爱用的本子啊一直留个暗格本没舍得用团购团购到现在还有全新未用的几本放着~现在还有吗？走过年回家买走！,0
楼下fang音乐的na个ni全家炸了日,1
哇，我们的叫板三剑客,0
你们自己看看吧像亻尔这种贝戋辶畐在东北看门的不管是大爷还是大黑都能给亻尔扌品木的嗷嗷的，还东北给亻尔的整体形象很不好[开心]亻尔真当亻尔自己是人丨jb了？话真他妈多，有能耐出来正面刚躲屏幕后面扣字个没完没了真瞧不起亻尔,1
家里会很脏吧，不过这样就不怕小孩子在家里乱画了你是否也有黑板情结呢，一块小黑板让你的家充满趣味！,0
热评全是几个眼熟的男宝，他们真的，我哭死,1
要亻尔女马把亻尔塞回去重新生一遍，脑门被门挤成一坨屎了才能干出这事，出生的时候衤皮亻尔女马夹过吧,1
亢龙老人都懂呀，九幽百鬼没有萌新，所有理都在他们那，笑死我了，原先的毒瘤帮会给萌新扣黑人CD的帽子。哦对来跟我吵架的会员狗就别来了，你们那一套见多了，有本事你们劝楼主删楼吵架一律不回,1
将来让老公讲给我们闺女听！,0
初四下午，二点至四点，万圣开放两小时，,0
除了性侵性骚扰你说的这些男的就遇不到了？自己戴有色眼镜。,1
祖国不会忘记是一首歌而已 我不知道哪恶心你的 西藏军属你也黑 你这种人也够恶心的,1
亻尔人丨亻囟儿夂辶畐,1
你信佛吗？为什么bu杀?？,1
锻炼颈椎啊,0
好像有解决方案了，50块钱了事，啥都不用了说要ICCID才能处理，可卡背面ID的已经剪卡剪没了。打电话给联通客服也说提供不了ICCID。我还是个球被来回踢！表扬批评前者拿了我联系方式1小时之内联系了。,0
Nicedrawing,0
尼玛的!是在jiao床啊？!还是遭轮奸了?!,1
顶！哈哈哈必须珍惜?好好珍惜我吧,0
天津悦榕庄度假和台儿庄古城之旅圆满结束了准备回家咯高铁站的KFC总是贵的，这个套餐平时才15元，高铁站卖40元我在这里:,0
第三张是我家小猫经常干的事。,0
哈哈，我家必须火北京昨天火了一个算是暗合，今天这个是真格的，话题营销。你说咋整，搞得我也刹不住车了！娱乐至死，。,0
太美了，,0
浙江人就是蜜汁自信，也不知道仗着什么，看不起这看不起那的，讲人家素质低，我也不知道他们素质低不低，反正我觉得你的素质不怎么高。,1
欢迎您再来老磨坊,0
再曝光，各自找偶象,0
那必须的，车行乐安卓版本，各大应用商城都有，IOS版本这几天就能下，欢迎体验，多交流！成功没？,0
又见刚子,0
你张的7很野兽派嘛！,1
你这是对付丈母娘的招败在痴情，赢在左右逢源赢在专情，败在左右逢情。,0
你长得真诚恳，很艺术…,1
你是五十万把你抓起来,1
叔儿~七阿姨说你很销魂~确实很销魂哈~,0
还给营销号的洗白微博买了头条亻尔他女马还要不要亻尔的辶畐脸了？？？,1
黑河南人会被骂，只好黑一黑东北了,1
来吧来吧~身随心动~他一个PPT的美图介绍，让大家身未动，心已远结伴去花间堂吧？点到过来回应一声^_^,0
孩子们的千手观音！,0
你这.张??脸可成了全球驰名品牌商标了。,1
29种不同主题的房间带你进入不同的美梦中应该是梦一样的房间设计吧,0
#优质食品需要靠谱食客来品鉴#嗯，画什么，这是个问题待婶婶好好思考一番~无任何添加的明星饮品，喝着放心，看着舒心，瞧那精致的包装看着就爱不释手我们自认为比三亚的新鲜椰子还要好喝,0
