Sentence,Label
06年夏我实习时叶兄刚进报社中青实习时，老记为师不摆架势，以实习生之名也可发大稿不计身份，新人不必端茶倒水扫地抹桌让我感念个人认为，他对实习生的认真负责，以后没人能超越了。两年前初次见面他一句“你们不是?端茶倒水的”，铭感于心。,0
你妈没拦着000你3说我是你亲爹吗,1
嗯嗯嗯，这句话亮了！,0
只是没见你那么频繁地发微博了。,0
作为一个四川人我觉得这种言论很丢脸。也不知道哪来的优越感，况且说真，川渝至少不算唯一最能吃辣的地区，据我观察，湖南湖北包括苏北的同胞其实也很能打，没见过这么爱BB的。真的丢脸。,1
人生若只如初见，劳资当初就就应在亻尔女马b里扌臿把剑，一刀刺死亻尔人丨小杂种，可惜亻尔这王八小样儿，壳还挺硬的,1
笑死人了！,0
《绣花针的诉求》,1
扔块肉在手jishang，狗都比你会连招。,1
明天下载激活，后天抢购，收藏起来吧。,0
我陪你们万万逼养的门,1
这个时候我还是和尼不交叉的，我如果合并起诉你就是多加几年，没有必要，因为我一直以来知道你脑壳不好用,1
为什么好男人都要遇到蠢女人,1
打是亲ma是爱，别总骂你ma，都快跟你妈产生感情了,1
我们这的回民拆迁款是别的地方的几倍。非法占道经营没人敢管。摘了警察的帽子就敢打警察还不会背处理。可以大规模的游行示威，都是聚居的打架斗殴的回民特别多，回民的风评在我们这非常差，小孩子都会被高度离回民的远点…… 反正各种特权坐标天津,1
iq6卡欠费了啊？,1
zha男,1
谢谢，亲给的好评，我们会继续努力的！,0
哈桑是男的，但男的也可以被强暴不是么？男上加男，很心酸，阿米尔太懦弱了,1
原来你都嫁给老外了，难怪被歧视。这种亚裔女的名声都不怎么好,1
所以说是胡来嘛。可是报价不低啊我这有芒果《爸爸去哪儿2》的广告位报价，人家都没要的这么离谱这是广告招商案。节目还不是照搬原版？这破台想扳倒芒果台绝逼没戏，都赶不上荔枝台的一半儿，只会胡逼乱炒，不是一次两次了。,0
言之有理，那就不去呗这么一说你说我是去呢？是去呢？还是去呢？//,0
还想当biao子，还想立牌坊。还不如直接说价呢，哈哈,1
刚看到群里发的:兔兔，你快从树上下来。。2013真是新年新气象！,0
本来就是反社会人格，逼啥逼，逼他偷东西了？逼他在新疆杀两人了？,1
酱酱多多看给亻尔急的买个股票别气得背过气，亻尔女马好不容易十买辶畐给亻尔赚五十万还得给亻尔看病！本人从不介入股票，涨跌与我无关，可惜亻尔没任何投资机会！只能舌忝夏建统屁股走可悲口马学生党!?,1
不出两年龙洋将走出南京影响全国谢谢亲您的书我收饭啦还有一本星期一给长征姐,0
草泥马的。情怀怎么了，你没有情怀就否定别人的想法，他麻痹的情怀永远就不是贬义词。工科臭屌丝，过你的老老实实本本分分没有思想没有追求的行尸走肉般的平凡生活吧。,1
想法同一的顶起??吧……我和龙应台一想法也是这么想的，是不是很威武。,0
女宝适可而止,1
人体蜈蚣,1
从?妈妈就告诉我，对?要怀有善意，后来我遇到了很多?，明?了不是每?个?都有妈妈。,1
很正常，二环内住的棚户区的老北京人，不光看不起外地人。连朝阳丰台都看不起。我被他们直接当面说过是外地老帽儿,1
是准备和公狗交配用的吗,1
他妈做鸡是无奈，为了养他,1
哭是不需要理由的！这小朋友哭起来咋那么萌呢？,0
#臻秀家族#我家是比较传统的家庭，爸爸是家里的主心骨哟…因为我的爸爸很爱这个价家，也为佳付出了很多呢…,0
神算子/本相基本代表了正确方向。如何评价？,0
机会?了！,0
//,0
火车上遇到一个沙比男，同样是站票，人家就能离你远远的，而这沙比死挨着你，人家唠嗑，他特么伸长脖子看，你前世是长颈鹿呀，真不知道老师是怎么教育你的，有没有教养，不看看自己是什么德行，臭不要脸，谁都想调戏，怪你姐姐我脾气好，没当面骂出你，mlgb,1
想吃意大利概念菜就来谱仕吧,0
不知老潘作何感想？[哈哈] //@崔向红:[哈哈] //@老鸭上树: [哈哈] 都伤这样了还撒一把盐//@票爷:太伤人了。。。。//@西祠响马: 我靠，我都被圈了一晚上了，你这又来一波。 //@和菜头: 尼玛把阿潘伤成这样了还继续撒盐！//@西祠响马: 哈哈哈哈,0
好一条狗,1
最好是彩虹的桥欢迎美妈来专吃下次来专吃下，上次都木有空肚子吃东西拉严重支持我们和之间架起一座溜达着就能到的桥梁！我肯定去的勤！,0
#音乐SPA#正在直播、#贵州旅游广播#欢迎收听。,0
偷井盖的是河南人好不？,1
龙门“三八”组合~#龙门镖局#同意同意同意~~~~~超级爱陆三金！支持三八！我是三八党！详情:,0
非洲3，黑人毛多，都是一坨一坨的长在一起。恶心啊。,1
懂不懂什么叫重国速度,1
很有意思，在各大五星级酒店中，香格里拉的中餐一直表现突出，为什么？酒香不怕巷子深，名厨不怕居山林。徐大厨越来越有名了，帝都都发来报道了,0
#昆航动态#2010年11月6日，在昆明市创业投资引导基金推介暨颁奖晚宴上，昆明航空有限公司董事长王清民（图中左五）从昆明市委常委、副市长刘光溪手上接过#2010泛亚地区最具投资潜质十强企业#证书和奖杯。昆明航空成为500多家报名企业中唯一一家获奖的航空企业。,0
酒肉穿肠过，佛主心中留！这餐真心不错，特别下饭。我吃完去打球就特别给力！,0
好看吧！还好用呦，一定要美美滴生快宝贝儿,0
远离女人，一生平安,1
镜头里的中国,0
甜蜜吧,0
回到广州,0
现在的狗狗都知道了啊！,0
我是河南人，但是我对周口驻马店的人真没好感，河南人的名声都是被他们败坏的,1
混搭呢？,0
风景如画！祝大家十一节日快乐!,0
我是出版社退休的，当知好书过眼、大赚其?。同行似无人约稿？新古文观止！是！一定妙不可言。按照武老师的意思，集结成书，编为《今文观止》，留给今人学习，给后人留下历史。这样的佳作盼公之于众，供我辈学习，并传于,0
老磨坊官门口店，好感动的一幕，幸福满溢的女人。。。浪漫什么时候都不晚，爱她就是要告诉她！,0
私人行为和社会行为的选择能一概而论吗打拳还得看男宝,1
支持一个,0
#北京柏悦酒店爱心捐书#再次启动，孩子们那一双双渴望知识的眼睛让人感动。。。看得好入神呀！,0
给老子摆正位置不好乱放屁，不haotai把自我当回事儿,1
转！,0
建议国家立法出台法律，对索要彩礼不给嫁妆的女方家庭，一律按敲诈勒索罪论处，强制规定嫁妆金额不得低于彩礼的80%，彩礼上限不得高于10万。(这一条好像已经立法了)剩男可以捯饬一下自己去韩国或者东南亚找老婆，,1
幼稚园程度的高中生，先天蒙古症de青蛙头,1
哟…你这是刚被雷过啊，还是zhun备去雷人啊,1
生日快乐,0
舞池之徒！,1
回去看,0
万物皆女权，我寻思女生们现实中但凡暴力点，多像男人那样搞些社会新闻，也不至于整天跟这些网络空口鉴拳大师们成天瞎比比。,1
ni的suo谓人身阅历在我看来一文不值，请不要把你畸形的价值观摊在我面前跟我跨跨其谈，真的很low,1
啥b这么值钱，只要是女人就有这玩意，男人几个是暴强？,1
qiang了buff转身就送你雷锋转世？,1
整了个娃娃,0
你打扮成这样，是对这个世界有...什么不满么,1
长点脸，扌察清眼，麻烦亻尔看清楚什么口丩脸色,1
嗯嗯比猪命猪身好多啦它们好像也不爱洗澡捏好贴合吖～,1
如今的电影很难排除那种动人心弦的爱情了~现场版比电影原声来的更有感觉大爱???好经典的现场，大爱、感动！,0
#中国梦想秀#Katara来自美国阿拉斯加，一上台她就和我们分享了学习中文的方法，那就是唱中文歌。梦想君从小就钟爱弹吉他的女生，听完Katara的歌曲串烧，梦想君不得不感叹唱的真好听……Katara的梦想是和自己的偶像同台合唱一首歌，恭喜萌妹纸圆梦喔~,0
Bvlgari白金4圈Size47...现货现货...我在:,0
内什么，北京东来顺的肉最好吃，回去请哈！不请我，出大事了吧？老师救命啊！吃我算了，我的肉更好吃请我及杨老师等在内的200人，包机，吃羊肉！,0
王建林我扌品木亻尔一夕匕女马？中国人操亻尔女马？他亻故啥了！我操亻尔女马中国人,1
期待期待期待最初推荐我听的歌手，没想到会来到自己工作的地方演出，期待期待期待,0
计划1月休息＋学习英语～突然领导找我1月去日本各种无语翻开护照发现原来签证刚好到期申请新签证要1月中旬赶不上客户的行程领导只得作罢嘿嘿～有惊无险1月那就是休息的月份哇～,0
"中国的性别歧视现象严重吗？,这个回答和评论区真的给我看笑了。,真实大型女权卖惨专场会。,还有俩女权男皇协军在那里一吹一愣，属实是忠心耿耿。,这个ID叫毕某某的，还搁这跟大伙抽局部数据呢？您知道现在宏观总体的真实数据吗？",1
#1028沃的新年梦想#见到刘亦菲本人…我比你白啊！哈哈～,0
"我就来说几个点…,第一亚裔在美国地位确实低，以我在美国留学7年的经验，如果说老墨地位最低的话，亚裔差不多倒数第三。,倒数第二当然是我们chingchong了，你不会以为亚裔=中国人吧。,好了该有人来评论，你这么喜欢被歧视在美国读7年书？",1
我可没说你不好脸，我是说不好脸的都是你这样的,1
你懂的，360的招术看多了！钉子汤的精妙之处在于：汤好喝是钉子的功劳，汤难喝是肉的罪过。切记切记，,0
戴老板预测国安准赢3：1国安胜必须的1：0国安胜，必须拿到出现主动权,0
这里是北京。度过一个个污染的日子，北京就是也有青春焕发的时候，怎么着。OurHome,0
好滴，下次来北京，可记得到聚点尝尝哦，聚点一如既往的欢迎哦。不客气?好好吃我马上回上海拉！有机会再来大家吃的开心就好哦。谢谢您滴支持,0
台湾“听攻略”出炉喽，想去的，准备去的，不妨听听，旅行必备哦。,0
今天休息给爹妈炖了一锅芋头烧肉，，，芋头放的太早都炖化了，这模样阿，，真是没法要，，但是这味道真心赞阿,0
其它都好，就是??????????????颜色稍暗,0
你妈已经被他睡了，他下一个睡你爸，让你爸准备好开张,1
谢谢马哥敬礼支持彩蝶计划，继续支持。彩蝶新的一年展翅高飞,0
赤板亭七周年庆及赤板亭餐饮投资公司成立新闻发布会中。祝游老板生意兴隆!大展宏图!,0
又鸟就是又鸟，五颜六?还是又鸟。,1
双标6的飞起啊[赞同]，一边不让别人以偏概全，一边自己又以偏概全，绝大部分人那就说明至少要占50%以上，黑人的犯罪率都没这么高，那说明所有黑人都是好人是吗,1
辈子都没干好事才会认识你888，连丢进太阳都嫌不够环保,1
这个名字！！！！月底回去帮忙！,0
种族歧视是不对的。但是我就看不惯黑人，怎么了。。。,1
没让你吃好，我们会继续努力吃过但是觉得味道一般般你吃过吗北京菊儿人家！！北京吃货全攻略每日分享北京那些美食~赶紧加入一起寻找北京美食吧！,0
好久没做这个，差点糊了，还好美味依旧！,0
林诗人，怪不得五毛啊！若非对薄王有偏爱，对南方系有偏见，何至于轻信如此拙劣的谣言？顺白：在下对南方系死挺某天才亦不齿，但其对薄王的揭露，犹待深入。现在那些人，习惯谣言倒逼真相，我很生气！林老师很生气，后果很严重,0
抱着火炉吃西瓜,0
金蛇狂舞，好运连连。。。,0
自己！！！你想到了谁？,0
大好河山风光好，中华民族不会老。华夏子孙一条心，购得丰碑永不倒。经济腾飞世界惊，科学发展别有情。锦绣河山更壮丽，中华复兴我辈行同行？赵老师好，我在农大招聘教师。,0
顶尖高手，爵士奇才，明晚8:00正式登场！！！我们都在期待,0
#新功能预告#千呼万唤始出来~,0
一半了。那么，目前，娃儿养了几个捏？,0
我爱你妈你妈的遗照笑得真美,1
湖北由于历史上一直都是分裂割据的兵家战场，所以养成了有奶就是娘的优良传统，武汉落后的时候天天跑出去黑武汉大县城，其实外省人觉得挺可笑的....九头鸟自己好好摆一下自己的立场,1
这几个逼孩崽子，我真就扌品木他妈的了,1
【给爹地和妈咪】清明节不放假，没法回家看你们啦。特此献上“无齿”照（第三张）、无证驾车照及各种卖弄照，报个平安。爸妈，春天快乐。,0
谢谢！生日快乐啊娟儿，你是好姑娘，快嫁了！,0
谢谢莫莫,0
资深孩纸常年5am.起床的孩纸飘过。。。不好意思，成了扰民啦。这……,0
因为智商是什么让他们这样看我们。。。二比快乐多啊，你看弯弯多快乐难道他们大部分人真的这么认为吗？,0
哇咔咔快到复活节啦诸多兔子列阵以待！可爱*^o^*吧你有木有想买个回家的冲动#美图秀秀Android版#,0
介么美的路口咋还想走!,0
【#超级笑星#精彩剧照】杨议老师！为什么你的眼神如此犀利~难道是因为刚刚张贡赫童鞋爆料的太多了么？,0
看到这图真是笑喷，于大妈你就从了任盈盈吧,0
没什么好包容的，越是包容越是无耻，比如，你给好心给他一碗面，他却还要抢你钱包。我就不怎么待见河南人， 一个两个河南坏人，运气不好，我忍了， 三个四个都那样那么即使10个中有两个好的，我也不要了。。真话，,1
广东省全交钱？还是潮汕地区全交钱？所以不敢出?义务2字。你当然没义务二字哈！证书封面颜色不一样，到目前为止，我所有证书全红面。另外我的初中证没义务教育4字。,0
我日你小二逼的小sha逼死孩子，你妈生你下来是给干嘛的,1
上帝把智慧洒满?间唯独亻尔撑了把伞,1
"很惋惜的看着他说：""手术能整回lai吗？""",1
我们折腾了一夜呀，这次旅行痛并快乐着，故事太多,0
好基友是一辈子的我可以没有女朋友，没有钱，可是我不能没有你。――致基友,0
当代小仙男们小少年们,1
就亻尔那眼缝，跟atm银行自动取款机插卡口差不多宽的能见度,1
那个孕妇三观不正。谁娶了这种女人谁倒霉！这种人不应该有后代！,1
太阳神呀太阳可以把被子晒成这样也是太不容易了。,0
今晚的成绩。我在:,0
你该躺在那,1
领着廖那厮，唐那厮！参加顾老师拍的毛片子，…蛋疼！,0
返祖现象在nishen上贯彻的很彻底嘛，you其是脑?,1
#三亚跨季营销蓝海体验推介会#【“精彩琼南?欢乐万人游”】各位领导共同按键，“精彩琼南?欢乐万人游”大型推广活动正式启动！这个冬天，有你，真暖！,0
可以去看这个，看能不能中阿,0
同时感谢大家的参与！谢谢大家对酒店的热爱！感谢,0
当你走在路上，看到一个心仪的对象，你会如何勇敢的上前表达自己呢？#城市有你真好#，DJ和你分享搭讪绝招喽！【2/22（周六）四川1400，其他城市的听众可以通过手机客户端收听哦！】,0
午间小食，车厘子，我特别喜欢吃这种圆滚滚的东东,0
北京那些太监不都是最右老乡教科书上北京人是尼生物学祖宗北京不是盛产太监吗？,1
微博上一些沙比选美国总统比你爹死了都重要一个个义愤填膺上蹿下跳的,1
laji,1
现在过来，时间刚好啊！周末愉快，就在今天，欢迎大家参与！,0
扌品木,1
保护生活本源，为身心找个放逐和栖息的美丽蜜地――瀑布林为旅游事业默默奉献付出的旅游人！,0
赶紧申请版权专利，否则棒子们又说是他们的~,0
他们是大白天使只进不出,1
你?嘛?屁股挡住脸啊！,1
太向往了我要去哦,0
吃海胆不吃海獭！不可能吧？海胆倒是很爱吃挖，吃海胆有助于拯救地球！,0
你不是失了智？ 河南人偷井盖你遇见过？,1
今天，准确地说是昨天，和我亲爱的观看了由人艺制作的＜第一次亲密接触＞，不论是演员的表演还是台词都很棒！我最喜欢痞子蔡的扮演者刘鑫的表演，用句歌词表达我的喜爱：说不出哪里好，就是谁都替代不了。呵呵。,0
取消公积金？专家都tm是sb饭涨多咯狗ri的瓜货,1
不到胡同就没到过北京，不夸张胡同会让你的五官全用上,0
哈哈哈哈真的很爱这部片～哈哈哈贝拉笑的好邪恶?,0
所以你的py现在是你们老板独享是吧真强！,1
八国联军在日你的表姊妈的时候没给你做好胎教吗,1
表不能经常带,0
继续替班，朋友们还在吗？,0
救命无语子一整个大无语小仙女在赶来的路上,1
人生哪容你卖萌？发懵有时，傻逼有时，全靠彼此大嘴巴抽醒！,0
你们俩何止亲密啊，能不含蓄嘛????鉴于咱俩的亲密关系，我顶你！,0
给你妈签一个一会就到期的生死薄。,1
看不懂内涵贴就不要来人家底下抖机灵了你不尴尬吗,1
【北方不懂南方的冷】取暖靠抖？不用抖了，教你一招：如果怕冷你可以去钻墙角，因为墙角有90度；如果还冷你可以去躺地上，因为地面有180度；如果再冷你可以自转一周，因为那样就有360度了；如果还是冷，那你就众里寻他/她，因为…………众里寻他/她千百度。（转）,0
欢迎凯旋归来！好好休息！,0
我不是草船，你的贱别往我这发,1
如果不是你，我这辈子都不会明白吹牛bdezhen正含义,1
你脑子里是有通古斯爆炸留下的坑？,1
你made骚货，锤子长在脑壳上，我都个性世博会怎样没喊你去展览,1
这个女的真的好下头,1
ma了个逼的,1
本人就是那种长相普通但是看起来特别单纯好骗的，学校里好几个黑人搭讪过，我都是假装听不懂英语完全不理，我感觉实在是太恶心了，唯一一个是在外面去北邮找我姐姐遇见一个西亚人吧，长得挺帅的，也是北邮的，,1
加油~今天想了很久关于你和其他遭遇了不幸的善良的孩子们的事情。真实的生活本就存在着极度的不公与无奈，但我们都要相信，经历磨难也是接近幸福的一步，只要活着就有希望~愿一切安好，爱你~,0
说人话,0
这么多年谁一向照顾亻尔啊？我很佩服他的胆量,1
正邪之分！,0
这个DJ秒杀我了，真人比照片帅多多了，你下次来西安咱一起去看他#我又花痴了吗#,0
想要自杀只会有人劝你不好留下屍体888以免污染环境,1
superphoto!prettylady!,0
小何，你觉得呢？，这算春运表情哇？,0
还好，我妈不是山东人，比较民主，要不然没法过。我家那些苍山亲戚经常来我家指着这个东西说给他儿子，那个给他女儿，日了狗了，眼瞎么，不怕我把他们赶走！,1
三八节大餐，各位女士节日快乐,0
粤珍轩的点心赞噢！,0
转起?期待哈?^_^说不定高兴了就定下集体活动的时间地点，一般人我不告诉他,0
亲子游，新加坡无疑最合适的选择之一常年如夏，基本每天都有出游的好天气。看看未来水世界的实景表演，坐坐变形金刚的红蓝过山车，再和史瑞克来张合影。亚洲最大的糖果店一定要去，5000种糖果，莫大的诱惑啊来自达人angela77妈用布拉制作的行程【新加坡亲子游】,0
"毛新宇倒不shi贪官,你不要冤枉他我靠，这种大腹便便的人，一看就不是什么hao鸟。ding是贪官。",1
是的！大炮的思路这是成都的娃啊！他以为是脑筋急转弯？估计是任总的思路？这真是神答题啊！你要气死爹妈啊！你要气死爹妈啊！,0
损失你吗粃，是当官的捞少了？明星钱也赚的不少要...,1
中国媒毒,1
下一年，继续爱丹丹~哈哈哈~先转了再看！脑残粉、HC粉，啦！,0
面粉进去，面条出来！会擀面条略过，话说我仅仅会这个了吧,0
早晨同事在屋里听歌，放了一首《千里之外》，有一句歌词是“一生有李白”。然后我就想，什么情况下能“一生有李白”呢？我分析，应该具备以下条件：⒈跟李白住得很近或是住一起；⒉比李白小或是跟李白同时出生；⒊比李白死得早或是同时去世。具备以上三个条件的人才能“一生有李白”,0
你妈生你的时候，把你扔了把tai盘养大,1
哈哈我觉得我长得挺像个厨师的哈哈,0
#璀璨人生#哇！画的好传神好像，好油菜的粉粉赫凡少爷你觉得肿么样？,0
已婚男女和未婚男女，好形象啊,0
#TIT创意园的美好生活#走出beta咖啡，发现隔壁公司的小朋友在跳大绳，工作状态很愉快！,0
明天就见冬儿了~~不管是出生之前，还是出生之后，你和妈妈都是一体的。。。,0
要是有选手羊了，我就杀了你的血妈,1
这么不好脸，这么mei心没肺，你的体重就应会很轻吧,1
标准的大吃大喝菜品不错，我们都饿了。还有萝卜汤。等待跨年,0
【唐拉雅秀相约中国?昆明】感谢对海航酒店的大力支持！,0
谢谢大家！谢谢这是今天最开心的生日礼物【#青春星期天#】感谢倾情加盟《#爱的妇产科#》！今天还是她的生日哦，祝她生日快乐！,0
吃我腕豪一记蓄意洪拳钕荏,1
亻尔长得真诚恳，很艺术…,1
＂福叠＂来了！谢谢亲爱的！转起！,0
亻尔丫活生生就是抽象派典藏啊,1
我在潮汕沙锅粥，准备开饭。。。,0
在法院门口被杀害的前妻，在自己房子里被杀害的前妻前女友，家暴男如果真的那么讲理就好了。,1
扌品木亻尔女马的半夜瞎jb吹还发鬼吓我黑名单见,1
尼的抽和你的脸没有关联,1
丫丫生日快乐~期待#断奶#！谢谢啦，同样祝我的偶像王菲，绍峰的女友倪妮，还有张雨绮生日快乐！我们都是幸福的狮子女。,0
期待启动仪式！哈哈，我就是搞俱乐部的我们这些会员是不是要认识一下呢？组织一个俱乐部吧！人气旺!有了这卡粉丝猛增啊！哈是80288，最多可以透支2000元呀!,0
我发现我就喜欢这个调调的东西转,0
男的好low呀,1
你每一天在镜子面前化几个小时的妆，腆着个逼脸还他妈敢出来蹦?呢，给你一双脚，交你何如屹立不倒，可你只学习并领悟了逃跑；上帝给你挺拔的教你百折不饶，可你只学习并领悟了找嫖,1
#五折烤鸭优惠券等您来拿！#现在通过淘点点手机APP预订一花一叶咖餐厅堂食座位，可免费领取一花一叶五折烤鸭兑换券，立省59元起。粉粉们，快来一花一叶淘点点手机餐厅抢吧！,0
喜欢你的喜欢！,0
和爱美食懂美食的人分享体验感觉真好！喜欢哟，还特别爱吃那里滴羊肉串、功夫鱼！,0
微胖是多微？肉肉的，好可爱，我喜欢！,0
反对个屁，人家根本不鸟你体弱多病的大流氓别说那么多废话，你先把朝鲜的核弹给解决了。再说，韩国在自己国土上部署防御系统，这纯属bie国内政，有你卵事？加高了围墙，隔壁流氓居然不干hai要抗议，这什么世道？,1
格子间的战友们，休息下，来吃块红柚,0
我要说你是个二愣子，我都时表扬你,1
有收获！,0
这才是我亲嫂子,0
看见这张面瘫的氵爫壬魔脸就恶心。劳资有情人撑腰无所畏惧[二哈][二哈],1
你看上取好研数像我昨天扔出去的那袋垃圾,1
艾玛，这个必须顶啊，速度抢购啊,0
亻尔一上动物园，满动物都趴笼子顶上瞅亻尔,1
我出两块让丫把翘臀露出来，就给丫一块大洋小费付费项目听说是让哥们儿说出来听听牛逼，巨臂就是招儿多右一有专门练翘臀的一套动作今威信说的,0
不是吧、呵呵，有机会来听相声！哥！好久没见你了！很想！竟然激动的哭了！没出息！呵呵！十三姨太？我在胖也顶不住啊！,0
好家伙 外地人直接成黑人了 ？尊贵的上海白人这是受了多大的委屈？ 真要这样 贴吧上海吧的人不得全被起诉种族歧视？ 外地人也没叫上海本地人不说上海话吧？但是，起码的交流要求说都能听得懂得普通话有什么问题呢,1
没文化还装比？,1
你说你，爷爷我教你练刀，你练剑，你还上剑不练，练下7贱！金剑不练银剑,1
