Sentence,Label
气得鼓鼓的，应该就是打这来的吧？竟有如此可爱的小动物，好想戳一戳它,0
第一个想到的是你俩那天的战争真的是太精彩了,0
还配上八种不同汁,0
新款的狠给力~~~,0
补发途秀达人的现场播报！坚持骑完全程的童鞋都是最棒的！#环外滩自行车赛#,0
呵呵长安城没有春天，当然也不会有秋天秋老虎37度，阳光下的车里41秋天的留坝，会留给你的不仅仅是温度～哈哈，去年都秋天了，对外的广告还是寻找22度夏天，被骂美了,0
hi博主，滚！我猜一定是蓝色，很可能是深蓝那种。。。,0
传奇！鱼姬鱼姬真是喜，飙风弄人把篮移。小人溺水竟未死，赢得他年成传奇。打油赠鱼姬,0
#手写明信片#来自澳洲的问候终于爬到我手上啦。你就继续馋我吧,0
英语还可以这样学！,0
#菲律宾之旅#飞机终于来啦！宿务太平洋航空的logo好可耐的~(^.^)今天竟然有点晚点喔。Cebu，美食，美景，我来啦！也是睡着来的。各位，晚安咯！我在这里:#首都机场T2停机坪#,0
像个小人了,0
哈哈哈哈哈哈谢谢这位美亲~~~~~其实我现在知道是谁了，人生若只如初见啊，我祝你幸福！！！！矮油，生日快乐啊！！公司最近流行匿名收花啊！！哈哈！！你看看，不单单是你哟！哈哈,0
只要路是对的，就不怕路远~早安，粉粉们~又是新的一周今天出门时，有没有感到些许秋凉的氛围？#早安絮语#,0
回覆那就将我的作品送给她吧。这几天正在教女儿认识石榴，就在学校的小菜园那里生活如此灿烂,0
在北方，同爷之孙称“叔伯兄弟”，再往下称“堂兄弟“。姨亲姑亲才会称为表兄弟。堂弟，写错了！谢谢指点！同姓为堂，异姓为表，到底是表弟还是堂弟呢？,0
还是你了解我哥也不总是坏脾气阿，也有温柔的时候啦！我觉得我是第三种…,0
真漂亮！祝贺中国歌剧舞剧院最新的这台晚会演出成功，几段群舞很给力,0
编段子的人真坏做个DNA确实内涵！喜当爹有点绕。确实内涵！,0
2013年瓶子要开始负责《时尚旅游》杂志的《美酒》栏目，每期4p，诚邀有丰富酒庄考察经验的高人来当我的撰稿人，稿费多多，美酒多多，帮忙扩散多谢??干杯／亲亲／阿拉地爱你／萨路的／扎大特纳／（配图是波尔多苏代的贵腐酒产区）,0
要想活的长变成小乌龟,0
来自雪山脚下今年的竹笋系列#人没动，物先行#朗园店开业准备中,0
爱烹饪的福利来啦,0
燕兰楼独有的特色菜有：清炒黑美人、灰豆、野生苦苦菜。灰豆和野生苦苦菜倒还知道是什么东西，这个清炒黑美人又是什么呢？,0
上海见！上海活动~,0
7道菜品都是由米其林厨师Anthony亲自设计的，绝对超值哦,0
"哇，我们大本营的英伦奥运行行程真是充满了惊喜！还有奥运探秘和女王庆典……真期待这一系列精彩内容！Bytheway,何老师和嘉哥真没给咱们丢脸，在国际明星旁边气质完全不输；关键在欧洲大个面前……这样谁还不信你们一米八我跟谁急！",0
你没拍下来？这个人我也见过,0
indigo希望每位客人都能在此体验到家的温暖。活力的一天，从indigo早餐开始吧。,0
随时召唤！周总，哪天我们一起来尝尝！,0
#旅游资讯#【#威海直飞台北#】威海国际机场和台北桃园机场将于12月31日进行客机直航试飞。威海将成为山东第4个对台空中直航点，航班初步安排为起程台北至威海6：45至9：20，回程为威海至台北10：30至13：20。话说，威海滴同学们去台湾旅游更方便啦！,0
2012第一站白河峡谷，5点起床7点东直门乘918快车出发。这里有蓝天，有羊群，有鹅，有冰河,0
看来5哥很理解和支持政府的工作噻,0
章鱼小丸子我的最爱！！！,0
生命的延伸来自于生活的真谛，有人问：你幸福吗？回答：嗯！还可以，难道被谎言收买了？估计家家都有一本难念的经。~,0
好好看。这比获诺贝尔文学奖的好看好看今晚又看了个长篇，不让人睡觉了！,0
??、巧克力、玫瑰花，一?都不能少，祝大家??快?、幸福甜蜜！,0
一如即往体现了水瓶的无情啊牛你敢测么？,0
年底，真心希望一天有48小时，满脑子事哈哈,0
几张连拍里选定的这张，表情不是最好的，但发丝的动感却是最棒的。非常喜欢这个感觉堪称完美的一张片呀，发丝擦过脸庞的感觉刚刚好这套白纱我的最爱出现了！感谢黑同学后期，继续发掘美片吧,0
出实力最具备表演天赋的，拍电视的人里厨艺最高的，那一定是陈庆大师了！别啊，哥看您说的,0
去撒个野好美呀！,0
领证两周年，在一起四年喽，时间过得好快，在婚姻里学习到很多，纵然很多人不相信婚姻，可是我依然相信有上帝的保守和两个人的努力坚持，婚姻一定可以幸福下去！感谢老公的包容和照顾，让我很幸福快乐。,0
亲，一定要来哦！都太餐厅自3月1日起开展东南亚美食节活动，除了美味的海鲜、寿司、甜点等美食外，又新添了很多东南亚口味的美食，等着您来品尝哦！,0
"康师傅又淘气了这个抽奖活动不是宇宙第一IT垂直网站办的，可能不是假的。这个活动还不错，我把链接贴给大家。""说出期待翻转世界的yoga，赢取联想移动硬盘""",0
"哇塞，马一个！“ThisbookshouldbereadbyallthosewithaninterestinthefutureofourplanetandinthechangingrelationshipbetweenstateandsocietyinChina”-TonySaich,HarvardUniversity",0
我的尼基塔呢,0
等忙完＂中国海疆旅游万里行＂活动，就去报名你们也做这个，我去,0
去啊，看时间有时间就去以后你都不去丰台文艺苑了吧？,0
让大小姐打包的,0
谁说不是......美很多.....那会儿的空乘真美啊,0
我们还有电商运营，需拍产品图片和视频呢。来看看下次拍视频可以找我们哦^_^,0
远通维景承办各类访谈节目还是很有经验的哦~~不想试试看？#分享【维景】正能量#哇~有美女明星来呀来远通维景，遇影视明星――给力！,0
哈哈哈哈，编剧这样写会被骂突然有一种。。蠢到极致无怨尤的蛋疼感觉。。这两个二货，真不知道该说什么了~~~奇葩啊“4楼住户闻到煤气味到2楼家询问，然后二人共同查找是否有煤气泄露，在此过程中，二人点烟”。。。已经不知道该说什么了。。。,0
大家想要什么涅,0
好照片是会讲故事的…这是我们应该学习的榜样～把心都看软了,0
亲爱的，周末好！周末好啊!,0
"这才是真正的角色互换cosplay,就是口味削微重了点！",0
水滴协会荣誉会员请大家关注这条消息,0
对,0
昨天是教师节、今天是911、明天是中秋节。在这里特别感谢我们的老师、已故的拉登同志、嫦娥姐姐能让我有三天的休息。祝各位朋友中秋快乐、健康平安！,0
我们张江的樱花也开了！这张感觉满日式的,0
据说：双鱼和巨蟹是我最配的星座太对了,0
美女公主和青蛙王子是不变的传说，想要快乐想要美丽，＂蛙＂一下今天来了好多美女美女爱美蛙下周去尝尝,0
"激动人心的时刻#微动日照#传播大赛大奖ipad实图奉上!感谢的好活动.东方太阳城给了我太多惊喜,美食霸占味蕾,美景俘获视觉仙山兔耳鳗鱼香螺,故地重游也仍有遗憾.日照,美就一个字,我还会再来的",0
我家的小美女，臭美妞一枚,0
悲惨的门牙,0
我已经晒黑了相比较，你太白嫩了！,0
出发，干活去！,0
成都宽窄巷子在镜头下更加有味道，好怀念在成都读书的日子????,0
“所有团队的程序模块都要以通过ServiceInterface方式将其数据与功能开放出来”，我真的震惊了！太这篇出现在G+的文章一个多月前就流传很广了吧。平台服务化在中国还是没有人能够彻底实践。开放平台和ecos的弟兄们请仔细多读读，尤其是第2和3段,0
【有奖转发】加#真爱无添加#转发本微博，写下你心中lessismore爱情定理并,0
跳绳,0
为了更准确的还原你的水彩画质感，这个系列的面料打版就反复了不下十次，最后呈现的效果还是很令人满意的吧～接下来期待我们更多的跨界合作,0
我的白fin。。。明白了，去斐济要穿白脚蹼！哈哈！进鱼嘴了！,0
哈哈，彼此彼此杂食动物,0
貌似都是针对中国说法犀利！,0
有爱，有好多爰,0
呵呵，亲的嘛！还以为妹子爱粉色系。小鸡也爱绿色系好精致丫,0
能让你上车铁老大已经很给面子了。我奇怪你怎么上车的？,0
私人了,0
外焦里嫩，口感完全不同，有入口即化的感觉吗还要等三周啊，臣妾等不及了啦,0
爱你彦砚姐,0
再来张彩色版的，嘿嘿。,0
看完蓝精灵了，影评：不错！把幸福快乐好心情传递给每个人有点回到童年的感觉啦啦啦啦啦啦唱首快乐的歌,0
十个月，穿梭于世界各地和有缘的每一个人，感受这一片恩赐之地。请你和我们一起，紧随着那即将幻化的繁星，攀升仙境。尚雯婕工作室赴冰岛拍摄新唱片视觉，尚雯婕化身为蓝发飘逸的冰川女神，身着MashaMa与Swarovski联合定制的星翼礼服，流光溢彩极致闪耀。,0
#西江野蔬节#北京的空气问题得到了重视，亲们也该多重视偶们滴身体啦，多吃些野菜，补充绿色维生素，小西爱野菜，小西爱周末~~,0
今年马年，老马很忙。,0
感谢分享！,0
难道你们没看到大姐吗你想多了！还有33333跟野男人会出名吗我看到你们背影了,0
就是舒坦！,0
呵呵，存钱赶紧来~哈哈赶紧给我勤俭持家存钱去！,0
家门口的感觉，真不错，浓浓的民国范儿！,0
【#超级笑星#开心一刻】老鹰们表示，天冷了，结冰了，走路比较尴尬……今天是中国传统二十四节气的“大寒”，也是蛇年的最后一个节气，天冷了大家也要注意保暖哦~,0
要多支持下你们自家的手机嘛“这个充电画面，每次充电的时候，看着电量数字不断的提升，就会发呆！”-Bambook出众的独特设计！其实个人最喜欢这个充电画面，每次充电的时候，看着电量数字不断的提升，就会发呆！动态的哦，咔咔！,0
要我年?十?一定?周生生??系列，太可?了！3020hkd?我??95折呢。墨西哥版?限量呢。也真服了那些年?人，?上找??托我下手,0
难怪我总喜欢新钱啊！谢谢捧场！其中有一个实验是在菜市场做的，我个人的personalfavorite,0
我们家这条线路唯一的一班公交车，终于换大车了。以后上下班没有这麽挤了。,0
总规？总归。,0
第一次在蒙古包里主持婚礼，给蒙古朋友主持婚礼,0
真快啊！都2年了！现在旁边那个金蛋可以使用了呢,0
Hello。,0
大师算的真准！这么闷的天儿，鱼也不咬勾啊,0
女怕嫁给入错行的男。男怕入错行，女怕嫁错郎，由此可见＂选择＂的重要性！,0
相当可以我可以笑么祖国处处有亲人啊这也能遇到简直太巧了,0
目前没有，我们9月会开，庆祝我们另一家新店的开张，两家店一起，这样可以更方便大家进行选择了就是没找到你家朝北店的围脖，所以没上，你们有围脖吗谢谢捧场马总，这就是在朝北大悦城便宜坊吃的,0
哈哈，这…我开心的笑一笑,0
黑贝进第3离5球还差3,0
保命四字诀揭晓！【大哥饶命！】欲知保命四字诀为何~半个小时后~锁定#超级笑星#哦！,0
今天持戒过午不食第三天，加油轻松,0
#我的登山季#人多出游欢乐多，吃喝玩乐长城边，水幽潭深山花开，老天作美我在这里:,0
明?又黎一个小聚,0
大爱欧舒丹手霜，用起来超滋润，而且是可以让手一整天的持久滋润嫩嫩的，那个香味也闻着很舒服，超划算的说，有一起买的mm们吗？,0
窃喜,0
别有深意的企鹅,0
能打7折？给我也办一张啊会员卡20元／张，随意买，很方便7折会员卡?没听过他们家还有这么低的折扣呢，还真成你们家食堂了,0
这眼神够凌厉不？？？,0
我们的客房分为老式电影院、海河河畔及欧洲奢华三种设计风格，将天津的邻里文化自然融入其中。祝您国庆快乐国庆期间有空来酒店！最最爱的酒店喜欢不同主题的客房设计,0
爱从婺源开始。我说，我要去看油菜花,0
我总是收到很多陌生号码的祝福短信，都不知道是谁发的，怪不好意思滴。,0
据说博士可以生二胎。嗯，那我准备去读博士了。想要第二个宝宝的姐妹们一起一起昂~~,0
"忧郁的眼神,唏嘘的须根……姐姐爱你",0
油菜花一代天骄，兰博基尼，泪看电驴儿把车超。,0
度假个8天6晚机票能拿到好价格，酒店、外岛等相关每人一万3-4差不多~请问去斐济至少要预备多少钱呢?期待ing……,0
#jingjing在乌镇#这年头叉烧都有假期了，在桥上只有大龙在职守孤独的守着美景我在这里:,0
小可爱又来了！,0
欢迎回归,0
恭喜恭喜，组个团来趟济南火老幺吃货行吧。上次吃完让我念念不忘的味道啊。山东的朋友们、和来济南的朋友们、我来济南了明天也就是26日上午10：18分，我和好朋友合伙的诚意开业！,0
想起高考的时候给哥们送助攻，丫居然抄选择题时都往后顺了一位怪不得哈佛毕业的林书豪这么牛这个必须有,0
欢迎地产金融家们常来聚聚聊聊！感谢和让俺认识这么多好朋友！,0
摄友马上有礼了,0
我们的摄影师先生要回来了,0
美味大餐，回味无穷啊???,0
创意无极限！无可挑剔！,0
车简直美死了~想起那句“宁在法拉利里哭，也不在自行车上笑”真理也百公里加速不到3.4秒,0
这个真好！恰同学少年,0
#豆果晚安#给在2014准备好的姑娘你，或者你的闺蜜?根据身型挑选适合自己的婚纱款式,0
恩~【抱抱】~乖~小吕治恩~乖【摸头】~不哭了哈~这个不一定准的~叔叔啊~~这个肯定有不准的啦~不要伤心啦~不?不?,0
呼呼快乐充实的假期是啊，超级丹，哈哈！太有意思啦,0
俨然买葡萄酒的文案，老干妈的AOC产地在哪里？Terroir如何？,0
“二”用英文怎么说,0
恭喜家族成员正在逐渐扩大！凯莱大家庭中又迎来一位新成员！,0
欢迎您入住石梅湾艾美度假酒店，海景房的视野,0
恩！经典！收了！咱也大气点的~~哈哈哈,0
今天早上路上堵???面街的一幕。我隔壁的一哥们很认真地说：领导很生气，后果很严重！,0
下次别这样啦低调！,0
这项目属于传统运动类我没狗可溜，只好一早起来溜女儿上学了。恭喜恭喜！感谢一直的支持！握手！！！,0
多么贴切的评述呀,0
我在这里:#天通苑北地铁站#大爱北京：春暖花开，阳光明媚，渴了有水，坐车有位，天天如此，该多欣慰,0
现实总是很骨感！,0
新年伊始！大家期待已久的水木锦堂铁板烧团购今天在美团网震撼上线，而且是清华店、朝外店两店通用哦！数量有限，迅速点击！链接：,0
#夏日花园#绿茵、喷泉、鲜花环绕穿梭宛若世外桃源的CBD核心区专属私密花园，是您消夏休闲的首选清凉之地#T-酒吧#邀您畅饮纯正【德国教士黑啤酒】【比利时福佳白啤酒】【时代啤酒】传统配方和独特发酵工艺结合，带给您独一无二的味觉享受伴您度过清凉一夏,0
传说中的微博掌门人在哪里？使劲儿私信三位美女：,0
好吧！能值一块就不错了只有摇摇两岁四个月的女儿最爱说的一句话：爸爸上班班，赚钱钱，（茵茵）坐摇摇。爸爸每次一听，脸上都现黑线：原来我在女儿眼中，只值一块钱。地址：,0
#2013艾丽华意大利美食节##美食分享#salamipizza萨拉米批萨,0
上午打开电脑写稿，发现眼睛很模糊看不清WORD文档。LG说这是“用眼过度需要补”，于是去买了一条鱼回来清蒸……吃完鲜嫩的清蒸鲈鱼，我的眼睛果然没事了继续写稿ing。。。LG很得意。。用不用这么立竿见影啊,0
听说#建家小业#剧组今天去上香，那我也去拜一拜吧祝票房大卖，各位情人节快乐顺便为事业、姻缘求了两支签，解的不太满意。二位大师能给解下么？我在这里:,0
那改一下，四川广播电视台内四星级咖啡厅…我给这里评四颗星四川广播电视台内豪华舒适的咖啡厅，是所有节目组在此商议阴谋诡计的地方,0
祝亲爱的朋友们元宵节快乐！,0
我会送你一份你最想要的礼物生日快乐（脚丫子太抢镜了大姐）,0
学做公益人，不亦乐乎！,0
俺闺女的中文可以，其他忽略温柔地一转，转给了女儿她的娘,0
ca嗤，早就有了。不信可以去问局长。还没呢,0
为四川国际电视节鼓掌！有作品的欢迎参评，无作品的感谢关注转发。,0
必须的哈哈，有时间去南方那吃饭。旭子咱俩一样我是充满吸引力的。我是充满吸引力的。,0
他长得真熊。。。表示很乐观~我对你丫的长相也表示非常乐观~~,0
下午继续继续！！！,0
邪?西多士，下午茶妙品??香港行家的支持~想吃不?怕肥~,0
关键是拜托几位大主编啊对海豚出版社而言，实现＂中国梦＂应分几步走。第一步，＂海豚书馆＂出齐100种，现在才63种，今年底明年初或可逼近70种。海豚初梦尚未圆，海豚同人应努力！63种64本，其中徐森玉那本上下两册。,0
这款车一定热卖！哈哈哈哈男人们是不是特想要啊,0
其实如果苹果能实现无线充电，那么推出一个内置核心，以后在一些合作的公共场所或消费场所就可以实现充电功能，而且这些商家不仅出电费钱也要给付苹果一定的钱。多爽。,0
嘿呦嘿呦拔萝卜居然还真有这首歌,0
新鲜生姜家庭贮存办法：A一带盖子大口瓶子，瓶底上铺一块潮湿的软布(湿了即可，水过多姜会烂)，生姜放在软布上，盖上瓶盖即可。B、花盆底部垫一层半湿的（洁净黄色）沙子，上面放一层鲜姜，再用沙子埋好，经常往沙子上面洒点水保持潮湿，这样生姜可保鲜时间较长。沙子太干姜会干瘪，太湿容易发芽,0
真的觉得菜不错！是我最近6个月间最满意的一餐！大爱！以后实在想不出来地方，咱就把这当作底牌吧；或者Xiaojing家附近的梧桐小聚也不错，个人认为是梧桐副牌hoho地方确实不错，菜也很精致,0
当苏梅遇上清迈希望今年能去，想一起的转起来,0
好久没起的这么早了，清晨的感觉真好，俺已经到到单位了，早安北京,0
想得开的人都胖了，哦漏。别否定真心真意动机过程愿望和之前的一切努力都单纯美好问题是什么样的结局才算美满,0
哎呦，哎呦，帅哎呦西服领带呢???,0
我果然学会了,0
宜家买的大瓦？很给力哦,0
土豪级的理想，吃货级的理想点赞！,0
Niceshot,0
春暖花开，蜂鸟横行蜂鸟好美啊,0
为什么一直在吃毛脚蟹吃个不停，因为他是毛脚女婿哦！哈哈，允许我一边去笑一会儿,0
突破以往流行歌曲演唱会的框架，将军营文化生活全面展示，结合杂技、音乐剧、舞台剧等多种形式,0
#ysl#YSL鳄鱼轧纹.迷你哦。3个。限量哦。9500微信abao289788,0
沙巴克传奇3永恒的话题同学们~~~沙巴克微故事征集活动开始啦~参加就有机会得到传奇3新年的周边大礼！,0
点评新功能~挑食。很有趣啊，图片和评论更加一目了然。,0
帅哥，你现在在哪哦，好久回成都，请你！现在想看你，除了你在电视上比赛，那就是我在菲律宾给你拍的照片了！口水直流,0
很壮观韩国做营销做的不错啊,0
好飘逸的秀发。,0
你看这个,0
不怕抄，要抄出特色哈哈2002年，盖茨手持微软平板电脑，无人问津；2010年，乔布斯推出iPad，风靡全球；2012年，鲍尔默发布Surface平板，人们说他抄袭了苹果。,0
他们有枪。我们有微博！在皇家驿栈，每位客人都是要客，平等是最大的尊重！难怪飞机延误多，不是流量控制，而是要客要出门。,0
聊完了肉肉，咱接着聊。主题:关爱小动物。,0
在家带娃好累，急需水疗，来个排毒香薰吧！,0
我的天，好黑的天，一场暴雨就要来了，赶快回家收衣服跑快点。,0
还想再去一次,0
＜勇敢的心＞是我最喜欢的一部外国英雄电影，中国的是＜董存瑞＞，推荐小孩儿们多看几遍！,0
老姚太惨了被这个二小姐逼得挨个挨特可爱的同学们永远相伴！,0
最后一天啦！要订要快！任一草莓9颗装礼盒，同时订购充??意的咖啡礼盒只要200块！竟然只要200块啊你再也找不到如此充满心意的礼物了，如果是微博上订直接私信给我，不经过淘宝，当场付款，只要110元！,0
好不容易遇上个不值班的周日，居然下了一天的雨，我真的服了哥一口气看了二十集#狄仁杰四#话说越看越起劲，晚上回来接到看,0
我每天吃都吃不腻。,0
亲们，新年大吉大利奥~,0
嫁接栽培技术起作用哪……油菜花！一篇好文，如此有思想和观察力的学生，竟然只得0分！,0
有道理。,0
可以买,0
赞哦,0
牙尖帮来起～,0
今晚有两点收获，一是我发现“核聚变反应堆”的内部结构比我这道名为“金屋藏娇”的菜要复杂，二是突然想起读初中的时候，看完《时间简史》以后的人生梦想是成为一个天文物理学家好啦，晚安啦，大家伙～明天分享会上分享氢弹与发电的关系,0
哥几个帮我出出招…今儿晚饭我要炖它…,0
为啥你们突然挖这个坟呀？,0
来张催眠神图~,0
【上海最妙的餐厅萤七人间】巨鹿路萤七人间，非常现代简约风且奥妙无穷！进门需要密码，午间套餐(58元)或是下午茶都性价比超高。晚上灯光幽暗，适合聊天谈事，也可以尝试下试管小酒，再去体验沪上最有名的洗手间，像个小迷宫似的，估计半晌都出不来！,0
也可以帮你挥霍！！！求妹纸挥霍,0
如果是这样，数据都不实。坊间传闻是无限讯奇（12580）。2008年成立，已经是OTA，看这个业绩，个人判断，难道是“天X联盟”？薛总，求证实。,0
AMaySing!63岁婚纱女王牵手27岁奥运冠军！原来体育界才是忘年恋的高发区啊~详细名单大盘点！,0
必须的！拍得真美,0
原来小玉如此养眼,0
#江苏旅游微榜单#小伙伴们~【2013江苏旅游年度微榜单】正式开榜！还等什么，快来为你喜爱的目的地、景区、旅行社、酒店投票吧！你的榜单你做主！更可以吐槽那些旅途中的坑爹事儿！而这些~都是有奖品的哟！一切尽在→→,0
膜拜右边：君登殿时我偏安，秦淮歌罢舞天坛，只恨同生不同命，北京骚死南京难。,0
那个什么“湿了紧了”的打车软件公司应该好好看看，什么是真正的文案。Nice软实力。虽然之前看过，还是要转，可爱的罗马尼亚人民！,0
皆さん、おはようございます今天名古屋多云，受台风3号和梅雨前线的影响，今晚也许会下大雨，回家晚的童鞋要注意了今天也一起加油呀！,0
天呀!我都不是的！您属于哪一类？,0
太可爱了你们见过如此英俊的宝宝吗你怎敢把我们的私房照发出来！豆粥以后会恼我！,0
是从南迦巴瓦出来快到丹娘沙丘之前的那一段吗？好象不是....远处的南迦巴瓦、白云蓝天，脚下峡谷中似青似绿？的江水缓缓流淌，眼前一簇簇一片片？粉的红的桃花灿烂地开，江对岸村庄寺庙的诵经声在峡谷中回荡。那天的我，无比的幸福！,0
啊？刚结婚啊，以为早就成家了呢，，，，王海钦同志终于把长头发减了哈，像少年胡JinT,0
最喜欢台湾同事来，有凤梨酥有美丽日记，今天还收到一只很心水的圆珠笔，桃心闪闪亮，如果是男同事送我的那就更心水了哈,0
Iwas!Butdatcoffee!!!!youlooksotired,0
大致不错！欢迎回家大郅，欢迎回家欢迎回家,0
抽奖咯！,0
主持成功收队明天中午龙岗婚礼也会给力他们说谢天谢地我来了,0
",你的脸肿么了？",0
夜色，美酒,0
欢迎滋扰电话全暴露了！！！！！,0
好哒。有空我来踩踩。欢迎大家来采小2的菜地看到第一次种菜，我也来秀下菜园吧，这里是我朋友的地盘，我来踩场子。,0
欢迎常回家看看,0
感动死了,0
亲们快来参加哦~,0
#书女沙龙#【让我们说说门罗――艾丽丝?门罗作品读书沙龙】2013诺贝尔文学奖得主丶当代短篇小说大师――关于门罗，你还想听到什么？特邀嘉宾：_著名作家，陆建德_社科院文学研究所所长，吴永熹_资深文学译者1月11日周六14点，地点崇文门,0
好额，我们也很开心哦,0
