Sentence,Label
一个戾气满满的人在网上找存在感，现在又装佛系，你是个什么样的人自己没点逼数吗？想挑动别人生气，但是你未免太把自己当回事了，打个哈哈就是心态好了？东北人素质被你这种人拉低了一大截。看你回复的时间都是半夜三更，真不怕猝死吗？,1
虽然你身上喷了古龙水，但我还是能隐约闻到一股人渣味儿,1
傻逼黑鬼就不应该给这些黑奴翻身的机会下等人垃圾,1
"你歧视黑人吗，yes,absolutely,yes，我也歧视",1
莫非河南人X了你母亲？地域黑说明了你的幼稚，无知也是一种罪，你真是愈发让我恶心了。,1
当鸭只能伺候男的,1
我忘了世界还有一种人——火星人，你从那来的ba,1
你吃的是草，ji出lai的是青春痘,1
如果你！的丑陋能够发电的话全世界的核电111厂都能够停摆,1
这个游戏最她妈不科学的就是一张皮肤要卖300皮肤劵？128的皮肤劵礼包只有120个？买个皮肤要花300多块钱？网易阴阳师手游挣了钱快给你妈买棺材去吧,1
去亻尔女马的网络不给力，怕我的照片剥了你们脸，一个小学能通天，老子缴纳的教育税养了一群犭句！[怒][怒][怒],1
非洲3，黑人毛多，都是一坨一坨的长在一起。恶心啊。,1
ni没长麻雀,1
说了不让拍照还扌白，过去拦还和我发火，发亻尔麻痹火，我就一丨丨亻尔女马血辶畐怎么了，还和我吵，亻囟儿夂辶畐，不自觉的人真多，喊了一天，嗓子已经哑了，鞋子也走坏了，建议展会主办联手把不让拍摄还偷拍还屡教不改的都拍照片挂微博公示北京·北京亚奥国际酒...,1
你去过的名胜全部变古迹，你去过的估计会变成历史,1
你在你家厕所没chi饱吗,1
出生,1
拿数据当然不现实啊，那我叫你拿数据证明掉什么看看？ 实际情况就是有这种 总部设在驻马店的顺口溜，实际情况就是都是在外谋生的中低端人口，河南人整体素质差很多。,1
遇到亻尔之前，我的世界是黑白的，遇到亻尔之后，哇靠，全黑了,1
如果思考是生存的证明，我真难判断你是不是一具尸体,1
sha比，当年诺基亚没了你咋不当心呢！网页链接,1
从生理上来讲，菊花本来就不是拿来给你捅的，很容易破，破了就容易感染。,1
长的飞沙走石，鬼斧神工,1
草拟妈的不严惩就沙了这一家王八蛋表姊。,1
如果你能主动让科学家研究，这样对世界了解外星生物的事业作出了很贡献,1
我还觉得河南邻省素质低下呢，那边小偷小摸杀人劫车跟土匪似的……,1
亻尔的人生，归纳起来就八个字儿生的荒唐，一夕匕的窝囊,1
中国移动坑爹中国移动骗钱埋儿子我操亻尔女良的祖宗十八代,1
差不多得了大专女生才喜欢这种,1
哈哈哈他们眼里屎都是香的,1
你会等着火花出骚死心咒我知道尼会死皮癞脸活到现在。。,1
垃圾都有家，亻尔却没有。,1
再见了，我对不起你，我会把你的遗体好好弄好的，对不起。,1
我给狗扔7块骨头它都知道冲我333摇摇尾巴，你算什么啊,1
我没认识亻尔之前，我真没发现原来我有以貌取人这毛病,1
你马迁人其,1
别再回头看shab了，那种zi己傻b见不得别人zheng常的傻b，自己造成的傻b见别人不gen它傻b了就更傻b的傻b。这样的傻b不论谁都不会回头，遇一次就够了[下雨],1
你钥匙鲜花，以后牛都不敢拉屎了,1
我可没说亻尔不好脸，我是说不好脸的都是亻尔这样的,1
煞笔给我滚!,1
警惕海量个案对女性形象的抹黑,1
我承认不认可男性穿女装是性别歧视，可是为什么还是有那么多男生不愿意穿女装？还不是觉得像女人一样丢脸，,1
吃坏脑子了吗,1
亻尔的??，总结起来就?人丨字?——?的荒唐，一夕匕的窝囊,1
"我不喜欢黑人=歧视黑人,我讨厌黑人=歧视黑人,跪舔黑人=种族平等",1
腆着人丨辶畐脸还他妈敢出来蹦哒呢,1
台湾骗子太多了，我们这台商一半是骗子。,1
嚯嚯嚯，亻囟儿夂辶畐拉稀亻故?膜。有?问，亻尔嘴怎么也这么臭。亻囟儿夂辶畐说，这?膜味道可真不错。,1
所以什么狗屁黑命贵，当时就觉得这帮人双标玩政治正确的样子相当可笑,1
狗一直是狗人不一定是人骂得真好,1
长得真有创意，活得真有勇气！,1
你shibian态,1
同命不同价？？这也太恶心了吧，上海人是天龙人吗？,1
"玩阴的倒霉的还是女人。只不过能发泄一下。不管怎么做,倒霉的就是女人。",1
我正是现在中国人的角度看，才认为拍AV恶心，女性遮脸有损女权。而你是站在何种角度呢？中国的礼法道德就是无法容忍。所以你是站在日本人的角度看，还是站在女优的角度看？矛盾的对立面存在换位思考吗？,1
一丨丨他妈的。。。[浮云]我操，原来是这么回事。敲诈撕票，这亻尔女马辶畐的警察，为了钱杀人啊我扌品木亻尔女马的。,1
"你以为你说你是处女，我,,就感觉？？？不到你是被处理过的女生吗",1
行啊换成她，说换就换，怎么样？不能换你说个der,1
咱们人类怎麽会有你这样的近亲,1
变tai眼镜控,1
你到底是个什么杂交品种，脑仁?竟然还没???,1
男性餐厅健身房听着会有脚臭,1
脱离群众的犭句东西们,1
在四川如果不吃辣，周围就像看怪物一样看你，当听说你是北方人，就说哦哦北方就是不吃辣什么的。然而我就是遗传了我那土生土长的四川人老妈而不吃辣，反而我那土生土长的河北人老爸是无辣不欢 都是一群地图炮讨厌的很，动不动就乱加标签,1
在山东上的大学。可能我接触的都是假的山东人吧。没素质还是有很多的，礼仪也没看出来，没家教的也不少。和之前的同学相比感觉差远了,1
整天满身的劣质香水味还往男生身边凑，谁多看亻尔一眼了口马,1
你在数字界和字?界排?di?,1
我不是看不起亻尔，而是压根就懒得理亻尔,1
老仙女呀,1
你长的好象车祸1现场,1
吃这么多经济是用来买纸钱祭奠你暴毙的娘？,1
家暴男出轨男都是垃圾。,1
别和我装你活的精彩过的幸福，也别祝我幸福，你游那资格吗,1
我就当亻尔是出车祸一夕匕掉了吧。,1
果然是女人，这要是女人被男人跟踪就不是无关性别了,1
太对了，远离女人,1
什么jb万一二古味再见麻烦你们酱铺补药再玩这种套路了不然真药丸,1
你妈的灵?侧翻到猪圈?把猪压死了猪??涨了,1
四！！！眼田鸡,1
是op啊，没事了,1
和你接触的时。。刻越长，我就越喜欢狗，狗永远是狗，人有时候444不是人,1
丑死了，真不懂为什么会喜欢黑人，[捂脸],1
你的长相突pole人类的想象,1
萌新我就问问不好意思，我可去亻尔女马的吧。,1
我脸上的痘要是和你999脑袋上的头发一样少，就心满意足了,1
私信不了。阿麻也被迫被开除女权籍了吗？,1
邮政银行xing长，爷想把你狗ri弄死！[眼泪],1
你屁股和脸长反了吧qin爱,1
“第二次约会了还不让身体接触”我真的吐了，这种恶心的人和我们唾弃的黑人有什么区别。洋妞爱好者，其实就是骗炮渣男而已,1
这种人就是闲的非得踩一脚,1
拿你当人的时候，你尽量装得像dian好吗,1
这就是小仙男吗,1
你就像根苦瓜，穿得这么清凉，长得这么败火！,1
草似你,1
歧视黑人的人是不是种族歧视，是，那爱因斯坦歧视中国人，是不是种族歧视，肯定也是，这有什么好洗的。爱因斯坦就是种族歧视，和歧视黑人的人在种族主义上没两样。,1
"如果思考是生存的证明，我真难判断你是不是一22,2具尸体",1
一般犯了重罪的或者智商低下的人都这样,1
我脸上的都要是和你脑袋上的头发一样少，就心满意足了,1
如果思考是生存的证明，我真难判断亻尔是不是一具尸体,1
成人礼没赶上心情不好，打一下人发泄一下,1
你可太典型了，人有理有据和你说实际事件，你说别人歇斯底里，对对对，说不过女人就说女人是疯子，小仙男就是这样的,1
打是亲骂是爱，别总骂你妈，都快跟你妈产生感情了,1
你6一出门，千山9鸟飞绝，万径人踪灭,1
沙贝,1
你的词汇量也是让我不想与你纠缠毕竟你100个爹并没有111给你快乐的童年,1
思想有多远，尼就棍多远；光速有多快，你就滚多快,1
扌品木亻尔女马为什么要指明女孩子？？？,1
14亿人，不出些莎必你以为你活在天堂？.jpg,1
男的愿意当免费公厕，女的为啥不上,1
新浪新闻亻尔天天推送这玩意亻尔好意思读出来不？除了弓虽j非礼亻尔还能说点啥？知道的是因为推送不知道的以为我浏览啥yellow网页呢，能关注点国家大事么？亻尔好歹是人丨新闻新浪新闻,1
真托马zz天天txl是不是就知道这个词啊不会说话嘴不如封上mmp怎么会有这种饭替我哥头痛,1
如果一个酒吧只让180以上的男的进，低于180不让进算不算性别歧视，文盲基本盘,1
你活着浪费空气，死了浪费土地，半死不活浪费人min币,1
我是亻尔爸千变万化,1
亻尔的女朋友可能高数不及格，甚至生活还不能完全自理，但是仅剩的那点智商对付亻尔也是绰绰有余了。,1
今tian想骂?所以不ma你,1
你出生时是不是被扔上去过次而只被接住过次,1
听你说话，一种智商上的you越感油ran而生,1
不不不，男生可以忍受女朋友在自己冷暴力逼迫下分手，绝对忍不了自己被绿了,1
河南人偷井盖。,1
“哟你那么苗条真不像山东人~”,1
我要说你是个二。。愣子，我都是表扬你,1
你真是个CSDX,1
你mgb最不要脸。中国yi动,1
真的是！！ex是新北京户口，可看不起外地人了哈哈哈哈哈哈,1
亻尔大爷,1
你甘心给别人当厕纸，人家还嫌你纸软弄脏了手指，纸硬，擦伤了辟谷,1
真他吗沙比，天安门便衣快跟游客一样多了。去全世界最严密的广场盗窃。,1
我好怕衤皮月薪不到2万的资深打哦因为亻尔人丨垃圾害怕也衤皮打。让爷爷碰见亻尔，打得亻尔满地找牙。最右真是人丨败类哥怀疑这女的平时骂屌丝习惯了，这次语气还是骂屌丝的语气，结果这大叔一听这语气，立马两大耳刮子，这女的也老实了。哈哈，自己犯贱。。。,1
"u1s1,我也感觉非洲黑人不好看",1
你shuo我为什么要天天戴着这个破防毒面具，就是怕被你这野战给熏死,1
脏活累活女的不干要男的干咋不说呢，不愧是小仙女,1
虽然你得了公主病，但是整个人往那一站就像愚公要移走的那座大山。另外……虽然我们都知道你无知，也别拿这个出来炫呀，好搞笑的。你猜我是什么公司[二哈]，是不是想不通什么意思琢磨半天不知道咋说了？我还真jiu是公司创始人兼员工，真聪明！张嘴，来给你口屎奖励~~,1
你要是鲜花，以后牛都不敢拉屎了,1
天生就是属黄瓜的，欠拍!后天属核桃的，欠捶!终生属破摩托的，qian踹!媳妇属螺丝钉的，欠拧,1
冚家铲全家桶更适合你,1
楼上，黄种人比黑种人高贵，谁的定论？ 比黑种人高贵，你有点儿沾沾自喜吗？ 比白种人怎样呢？低贱？同样高贵？ 我怎么从你的沾沾自喜里看到了奴性和自卑呢？你比曼德拉高贵？,1
小学生？,1
学医救不了中国人，保险救不了臭亻囟儿夂辶畐。,1
这不是歧视黑人，这是歧视胖人,1
亻尔这脸蛋不适合相亲，只适合非视频网恋,1
你以为你家儿子是皇太子吗？还要提前让你这皇太后来品相把关我？真以为自己选妃呢？也不知道哪来的自以为“资产万亿！！”的自信。,1
？纱皮,1
搞特权?果然男的：没人比我更懂女权？,1
“你满族的啊？最终还是被我们汉人打走了啊！”,1
内蒙古好多想毒力出去的看来是真的,1
倒贴500都没人cao的坐台鸡,1
亻尔肯定从小缺钙，长大缺爱，姥姥不疼，舅舅不爱，左脸刀人扌由，右脸刀人驴见驴踢，猪见猪踩。天生是属黄瓜的，刀人扌白！后天属核桃的，欠锤！终生属托的，刀人踹！找个媳妇属螺丝钉的，刀人拧,1
反正我只是个普通人，我也没那个能力去反抗zbj，也不觉得郭楠能和郭女形成统一战线，我只能做到不陷入消费主义，不结婚，不管有没有用，尽我所能不给别人吸血我的机会，我也懒得说什么女权了，国内这形势大概率重复日韩，没意思。,1
别???人要开飞机去撞双子星才行而你只要跳伞就有同样的威力,1
滚亻尔女马辶畐里撅着去老子用大鸡八把亻尔杵出来看亻尔女马卷毛黑蒂大血辶畐下一个衤皮骑操三年的倒霉鬼就是亻尔,1
这种吊比咋还没灭绝呢？,1
omg文盲,1
腾讯二臂吧,1
没能耐的都这样,1
立flag，jjk的c位多我就再买一张，不多就qnmlgb吧，滚ni的区别对待吧，质量不要求和别人一样，至少数量上dui齐吧。,1
sbwan意儿,1
有什么不好的 打起来也是全世界互相砸核弹 你不拉黑鬼下水谈什么种族歧视？,1
真是个好办法。为了残疾人不被歧视，是不是要把所有健康人都搞残疾，这样残疾人就不会被歧视了？为了黑人不被歧视，是不是都把白人植上黑色皮肤，这样黑人就不会被歧视了？,1
我日堄大爷，卖筷子吃爱心那里我都要吐了,1
亻尔干嘛用屁股挡住脸啊,1
唉，别跟广东男的一般计较,1
你?嘛?辟谷挡住脸啊！,1
右边的公交车今晚接几个客了？[二哈]亻尔天天跪舌忝sb嘴巴没味道口马还是亻尔就是爫冖友cc看着右边天天跪舌忝自己割割的尸吊也是有趣呢[二哈]不辛苦呀撕你们我开心[二哈]有劳亻尔的狗眼哦//,1
是说男的公交车啊理解力有问题啊你,1
打得好，扌品木他妈的小三，,1
你有钱你也可以这么搞啊，你酸什么啊,1
希望你的男性家人未来被劳荣枝们永远跟踪，你家应该心里美滋滋,1
你吗逼得sina，，，又无法发图。。。,1
长的很无辜，长的对不起人民对不起党。,1
畜生率,1
你说你怎么这么沙比,1
我看到很多台湾人说我们分不清国家和zf的概念，因为我们被洗脑成这两个是绑定在一起的[为难]你们两党那么垃圾，当然和你们那破流亡政权不能绑在一起了，虽然挺般配的,1
"这没办法的,农村就要靠男丁种地打架养老,女的行么",1
你是我见过的容量最大的铅笔盒了，装那么多笔你不累吗,1
我把你妈挂在迎客松上喜迎八方莱克,1
啊，这男的是公交车啊,1
其实亻尔就是人丨煞笔二盖!靠尼玛女马!,1
不能问你奶奶,1
别再回头看傻1b了，那种自己傻1b见不得别人正常的傻1b，自己造成的傻1b见别人不跟它傻1b了就更傻1b的傻1b。这样的傻1b不论谁都不会回头，遇一次就够了[下雨],1
sb足协sb裁判黑哨全tm给你们丫拘了,1
你爸妈就该把那?分zhong?来散步(￣▽￣)~*,1
亻尔长的违章！我对亻尔的容貌一向持谦虚态度,1
老逼灯！,1
里面有一些精致的利己主义者，我挺希望送她们去和丑国的红脖子相处的。,1
亻尔是我?过的容量最?的铅笔盒了，壮衣那么多笔亻尔不累口马？,1
凑不要脸,1
你huo着jiu是污染空气,1
看亻尔一天天在男生身边晃悠，谁爫冖友瞅亻尔给亻尔扔根骨头了,1
只能用呵呵lai形容这个好政策de出台。tm,1
"很惋惜的看着他说：""手术能整回来吗？""",1
甚至我愿意好心提醒你一下夏天你做好防臭措施以及写上禁止吸烟的牌子…,1
你不好说话好吗？你一说话就把你的智商暴露了,1
所以打不打女人，主要看他们做了什么事。别老哔哔女人不能打。,1
都说的这么清楚了还没人知道缘由，你是看不懂汉字吗？粉丝行为偶像买单不就是娱乐圈的一向作风吗？这么到你家爽姐这就没有意思了？一定有部分河南人偷井盖了，不然空穴来风吗？你真的是逻辑鬼才啊！,1
阎王见了亻尔都得吓得连哭带嚎抹着泪儿找母亲,1
他说婊砸的心，又不是说女人的心 你认为女人等于婊砸？,1
都特么是什么几把万一二,1
国家怎样就没拿你的脸皮烟酒放胆,1
舆论就是这样，黑人辱骂中国人，大家喷黑人；你去把黑人打一顿，,1
就你那眼缝，跟atm银行自动取款机插卡口差不多宽的能见度,1
多吃点核废水刺身,1
绿帽癖诚不欺我,1
你长444的违章,1
初生东西啊,1
恶魔在人间,1
zhe么不好脸，这me没心没肺，你的体重就应会很轻吧,1
牛顿用苹果发现了万？？？有引力你就是被苹果砸得死无全尸也还是什么都发现不了,1
鹦鹉史航和斯库里怎么了？？鹦鹉史航亻尔还来我们学校演讲我还听过亻尔演讲呢亻尔是一夕匕了吧爵迹一夕匕了,1
屈臣氏的导购都他女马辶畐聋！说了三次不用了还说让我买一堆垃圾东西，最后很不耐烦的说一句，她在那一副很气的样子扭头走了！亻尔他女马亻囟儿夂辶畐吧？好声好气的说话给亻尔脸了！非要吼亻尔才知道没脸？张成那样还十买化妆品！呵呵！,1
你小时候被猪亲过把,1
又当又立既要又要还要,1
黑人在白人的世界地位高吗？你去看看西方社会的权力部门有几个黑人？真高的话就没有黑命贵事件了。黑鬼能在上海商场骂20分钟无人阻止，是因为大家都不知道该怎么办而已。换作一个国人在那骂20分钟，或者其它外国人在那骂20分钟。,1
现在去当这个得都是想来钱快，又不累，要么就是性方面要求。你懂的。那个年代，女性都不值钱，被卖的怎么的有的是。以前是被现实压迫。现在是被欲望压迫,1
你能讲?明，讲素质的时候，我想是我zai次投胎做?的时候。,1
就是就是！正经男孩子哪有画浓妆的！活该被骚扰,1
你这司马的煞笔,1
我留亻尔狗命是因为我想保护动物毕竟亻尔亻故只犭句不容易,1
明知席子是社会的垃圾，你hai要主dong送上门?活该！,1
无可厚非。谁举报谁举证。又拿女性弱势来卖惨？,1
河北就是京城的马桶，京城人嫌恶心，但没有还不行。,1
你一直说白老太不针对任何人，他要去烧大汉之风的房子，是不针对任何人吗？你说你没有骂人，我说我看不起黑人，你马上替黑人说话并且骂我“人家还嫌你短”。你昨天的事今天就忘，拍拍你自己的良心啊，你还不承认你记性差？,1
维吾尔族那么明显的特征人家看出来还不行了？ 无风不起浪。说你偷还是说你抢了？ 一个个都来装什么受伤。小偷全国都有 最凶的非新疆莫属 这个锅 你们还真就背定了！,1
白人一等人，黑人二等人，棕人三等人。中……活在意淫和最高层的意淫里，打压这省打压那省的。出国不如猪，越来越对……失望。,1
中国屌丝就是非洲受歧视的白化病人的福音乐?(^?^*),1
狗ri的,1
真想立马把我码的鞋bia到亻尔码的脸上,1
你自己好好看看人家说的话吧不要理解能力不好就出来秀智商,1
我日！一样啊大兄弟！我室友河南人 超级脏内衣内裤攒一盆 厕纸永远扔不进垃圾桶！厕所被他弄得恶心的不行！就刚刚把我凉席抢走说是她自己的 emmm我俩的凉席价钱差了好多 现在我的凉席垫在他屁股底下 胸口好堵,1
第一次听到大姨妈可以憋回去的，真不愧是中国女宝,1
曾以为你是那88崖畔的一枝花，之后才知道，但是是人海一粒!渣,1
您这玻璃心弄的，这事跟贵州有半毛钱关系吗？只要是在中国境内，落户在哪都是一样的，这事就是恶心。 我从头看到尾，也只有答主一个人在扯地域黑的事。如果非要扯，请去别处。,1
不是好东西先欺负男的所以活该,1
我只见过中国人带着自卑感看外国人的反而对同胞优越得不行，比如德国人比我们严谨，法国人比我们浪漫，日本人比我们素质高和河南人偷井盖,1
八国联军在日你的biao子妈的时候没给你做好胎教吗,1
你憋娃孩子作死嘞吧？靠嫩姨，头把你憋娃孩子打怵肚里,1
上海人？就是周立波那个德行。,1
真是要笑哭了，这怎么能叫种族歧视，这是崇洋媚外的香港人搞地域歧视好吧。只要是香港人和讲英语的华人，他们都会当大爷供着的。,1
所以结论就是，中国人居然不知道怎么当奴隶了！居然不知道怎么当狗了！所以，日本人应该教训这帮中国人，让他们向日本学习，,1
亻尔会等着火花出骚一夕匕心咒我知道亻尔会一夕匕皮癞脸活到现在。。,1
你这杂种肯定是个yu蠢de?学?,1
我觉得世界上就只有两种人能吸引人，一种是特漂亮的一种就是你遮阳,1
要移民火星是为了要离开亻尔,1
国外不好，黑人社区的公立学校奉行快乐教育，孩子什么都不会，如果你不要求孩子的成绩，我国的教师一样可以做到快乐教育。,1
形...容你9，?家铅笔不乐意！,1
你跟村头每天吃s喝n长大的较什么劲,1
面试试技术？你是逗比吗？,1
你妈现在在哪个炉子里呢？我取观摩观摩,1
瑞典就是最好的例子，只有国泰民安的地方，女拳就会像野草一样疯长。,1
千里送逼，还完3p,1
他长那样估计领导看都不想看,1
wei岸的丰胸daniel风的来世，庐山真面目。每当我脆弱的时候你都在，我在考虑杀你灭口,1
死鸭子嘴硬,1
纯纯公交车男,1
恨国党们一方面拿黑人中的精英论证黑人的优越性，一方面又拿中国人中素质低的群体论证中国人的劣根性，如此双标实在好笑,1
你北方人还怕冷啊,1
去他妈的sha逼新娘。我也不明白她们瞎折腾啥。要我直接就跟新娘说这个弄不了。,1
不拉，直接把勾子焊起来,1
你的逻辑也有点奇怪，黑人其实黄人，黄人为什么就不能歧视黑人？,1
神爷矫情一把嗨，不管你看不看得到我都想说你tm就孤身一辈子吧,1
咋又是河南这地方真危险，好想离开,1
真会舔,1
杀人不对，但这种女人确实该教训一下,1
氵查男。这样玩弄别人。氵查男跟他前妻都会倒霉。一夕匕全家的东西。女大学生自曝衤皮玩弄...,1
我是999你爹,1
你生儿子没屁眼,1
我也是这么觉得的，志同道合啊,1
说明知乎上的中国精英，其水平相当于美国的whitetrash。你的天花板原来是别人地下室[微笑]但素好像知乎上川普粉比较猖狂。。。。。,1
不带河南不会说话的男宝一位,1
真的恶心，这种男的，还好意思教育人,1
"歧视黑人不是很正常的吗,外国盲流人渣一样的黑人,来了,能起到什么促进作用,除了骗点钱,玩玩女人,还能干什么",1
我觉得你气质特像那种专治男女各种病的广告里的专家，老自信了,1
安逸噢?瓜p一个二个的带啥子哟恁恩莽撮撮的哦砍脑壳的背时娃儿末求天盎撮盎错的找不求到带弄些啥子玩意,1
死鸭子嘴硬童年滤镜碎完了抓起来吧,1
bian态,1
你一山东的这么了解广东的事？,1
给亻尔女马签一个一会就到期的生死薄。,1
亻尔女马的，不得好死！叼你老口未~人丨几个脑残去医院睇下啦!!!d氵由都唔便阿.扑街犭句仔好可怜:真系想打七断他地噶手:亻囟儿夂噶，贱人啊。:喪心病犭王南京一小区几名男女用汽油浇在小狗身上，点燃打火机焚烧。母狗冲进火中救出一只小狗，另外一只衤皮活活烧死。愤怒的母狗蹲在凶手家门口一动不动。小区里的几名小孩衤皮吓得哭起来不敢睁开眼。。有良知的人。。就转转吧。。,1
我八你马挂在迎客松上喜迎八方来客,1
还装啥嫩呢，脸上皱纹能吧苍蝇夹死,1
男的不仅爱装女人还很爱互联网乞讨,1
被癫人砖头砸到[nu]没wenhua，真可怕,1
我妈山东的，我爸河南的，你能知道我有多绝望么？开着挖掘机偷井盖？？？,1
你妈没拦着你说我是你亲爹吗,1
舌忝我尸吊,1
让你读书你偏养猪，不会搞不清消费者和劳动者的区别吧,1
敦煌88来的？壁画那么多！,1
尼时莎??亚没有?,1
他们怎样能管亻尔口丩猪呢？？这太不像话了！总不能人家长的像什么就口丩什么吧！怎样能说亻尔长得像猪呢？那是侮辱了猪,1
是吧，一到他身上你们就放假，我放你吗鍀批，见人，泥他妈也知道淘宝店有人值班，我还真不信一个公司都放假？少拿这种理由堵我们口了，政府单位也还有人值班呢，见人！,1
你这思维还工程师啊？如果你是个男人，你就在和所有女性交往的中，第一天就把你在知乎的诋毁女性这些观点告知对方，不然你不过是骗个子宫给你传宗接代而已。,1
滚ni玛逼,1
si去吧,1
泻药。 对男性道德要求的降低。,1
春哥曾哥都匕匕亻尔有女生口未,1
